,County,Property ID,Price per month,Address,Property Description,Date of Listing
1381,Leicestershire,listing_64621173,"£2,058 pcm","Kirby Road, Leicester LE3",5 bed terraced house to rent,Listed on 15th May 2023
1382,Leicestershire,listing_64293679,"£4,881 pcm","Hinckley Road, Leicester LE3",5 bed detached house to rent,Listed on 30th Mar 2023
1383,Lincolnshire,listing_64613164,£495 pcm,"Station Road, Scunthorpe DN17",1 bed semi-detached bungalow to rent,Listed on 12th May 2023
1384,Lincolnshire,listing_64858510,£550 pcm,"The Meeres, Kirton, Boston PE20",2 bed property to rent,Listed on 13th Jun 2023
1385,Lincolnshire,listing_64733928,£575 pcm,"Sidney Street, Cleethorpes DN35",2 bed terraced house to rent,Listed on 28th May 2023
1386,Lincolnshire,listing_51809344,£625 pcm,"Summerfield Drive, Sleaford NG34",2 bed terraced house to rent,Listed on 1st Jun 2023
1387,Lincolnshire,listing_64707473,£675 pcm,"Winsover Road, Spalding, Lincolnshire PE11",1 bed property to rent,Listed on 24th May 2023
1388,Lincolnshire,listing_64764695,£680 pcm,"The Lodge, Abbey Road, Grimsby DN32",2 bed flat to rent,Listed on 1st Jun 2023
1389,Lincolnshire,listing_64142707,£700 pcm,"Daubney Street, Cleethorpes DN35",3 bed semi-detached house to rent,Listed on 8th Jun 2023
1390,Lincolnshire,listing_64659281,£700 pcm,"Church Street, All Saint Mews, Gainsborough DN21",3 bed terraced house to rent,Listed on 18th May 2023
1391,Lincolnshire,listing_64591676,£710 pcm,"High Street, Boston PE21",1 bed semi-detached house to rent,Listed on 10th May 2023
1392,Lincolnshire,listing_61495661,£725 pcm,"Northolme, Lincoln DN21",3 bed terraced house to rent,Listed on 8th Jun 2023
1393,Lincolnshire,listing_64835978,£725 pcm,"Bakers Way, Morton, Bourne PE10",2 bed terraced house to rent,Listed on 9th Jun 2023
1394,Lincolnshire,listing_64655337,£750 pcm,"Victoria Street, Grantham NG31",2 bed terraced house to rent,Listed on 18th May 2023
1395,Lincolnshire,listing_64700109,£750 pcm,"Victoria Street, Grantham NG31",2 bed terraced house to rent,Listed on 24th May 2023
1396,Lincolnshire,listing_64799119,£750 pcm,"Brewster Avenue, Immingham DN40",3 bed semi-detached house to rent,Listed on 6th Jun 2023
1397,Lincolnshire,listing_64833357,£750 pcm,"Leveret Chase, Witham St Hughs LN6",2 bed parking to rent,Listed on 9th Jun 2023
1398,Lincolnshire,listing_64862843,£750 pcm,"Orchard Street, Spalding PE11",1 bed bungalow to rent,Listed on 13th Jun 2023
1399,Lincolnshire,listing_64855744,£775 pcm,"Wyberton West Road, Wyberton, Boston PE21",3 bed terraced house to rent,Listed on 12th Jun 2023
1400,Lincolnshire,listing_64486198,£795 pcm,"South Parade, Spalding PE11",2 bed semi-detached house to rent,Listed on 26th Apr 2023
1401,Lincolnshire,listing_64639962,£795 pcm,"Willington Road, Kirton, Boston PE20",3 bed terraced house to rent,Listed on 16th May 2023
1402,Lincolnshire,listing_64707432,£795 pcm,"Willington Road, Kirton, Boston PE20",3 bed terraced house to rent,Listed on 24th May 2023
1403,Lincolnshire,listing_64718287,£795 pcm,"College Street, Grantham NG31",2 bed terraced house to rent,Listed on 26th May 2023
1404,Lincolnshire,listing_64582225,£825 pcm,"Beckside, Rothwell, Market Rasen LN7",3 bed semi-detached house to rent,Listed on 9th May 2023
1405,Lincolnshire,listing_60407292,£850 pcm,"Snow Close, Holdingham, Sleaford NG34",3 bed semi-detached house to rent,Listed on 12th Jun 2023
1406,Lincolnshire,listing_64786739,£860 pcm,"Ormonde Close, Grantham NG31",3 bed property to rent,Listed on 5th Jun 2023
1407,Lincolnshire,listing_64655787,£900 pcm,"Turnstone Drive, Scunthorpe DN16",3 bed property to rent,Listed on 18th May 2023
1408,Lincolnshire,listing_61800591,£950 pcm,"Victory Way, Sleaford NG34",3 bed detached house to rent,Listed on 2nd Jun 2023
1409,Lincolnshire,listing_63765081,£950 pcm,"Station Road, Old Leake, Boston PE22",5 bed bungalow to rent,Listed on 19th Jan 2023
1410,Lincolnshire,listing_64782521,£950 pcm,"Zabir Close, Deeping St. Nicholas, Spalding PE11",3 bed semi-detached house to rent,Listed on 3rd Jun 2023
1411,Lincolnshire,listing_64536227,£975 pcm,"Cherry Tree Crescent, Cranwell NG34",4 bed detached house to rent,Listed on 3rd May 2023
1412,Lincolnshire,listing_64821915,£995 pcm,"Primrose Way, Stamford PE9",3 bed semi-detached house to rent,Listed on 8th Jun 2023
1413,Lincolnshire,listing_64822294,£995 pcm,"Kedleston Road, Grantham NG31",3 bed terraced house to rent,Listed on 8th Jun 2023
1414,Lincolnshire,listing_64857893,£995 pcm,"Meeres Lane, Kirton, Boston PE20",3 bed property to rent,Listed on 13th Jun 2023
1415,Lincolnshire,listing_60417742,"£1,000 pcm","Cornstall Buildings, St. Leonards Street, Stamford PE9",2 bed property to rent,Listed on 28th Apr 2023
1416,Lincolnshire,listing_64877800,"£1,000 pcm","Perth Road, Stamford PE9",3 bed terraced house to rent,Listed on 15th Jun 2023
1417,Lincolnshire,listing_64872843,"£1,100 pcm","Sycamore Crescent, Lincoln LN6",4 bed detached house to rent,Listed on 14th Jun 2023
1418,Lincolnshire,listing_64478978,"£1,150 pcm","Ash Gardens, Ancaster, Grantham NG32",4 bed detached house to rent,Listed on 25th Apr 2023
1419,Lincolnshire,listing_47820057,"£1,200 pcm","Welton Road, Nettleham, Lincoln LN2",4 bed detached house to rent,Listed on 12th Jun 2023
1420,Lincolnshire,listing_59962183,"£1,200 pcm","St. Leonards Street, Stamford PE9",2 bed property to rent,Listed on 2nd Jun 2023
1421,Lincolnshire,listing_61654681,"£1,250 pcm","Theddlethorpe Road, Mablethorpe LN12",3 bed detached house to rent,Listed on 3rd Feb 2023
1422,Lincolnshire,listing_64738367,"£1,250 pcm","Grafham Drive, Waddington, Lincoln LN5",4 bed detached house to rent,Listed on 30th May 2023
1423,Lincolnshire,listing_61973980,"£1,300 pcm","Witham Wharf, Brayford Street, Lincoln LN5",2 bed flat to rent,Listed on 13th Jun 2023
1424,Lincolnshire,listing_39005753,"£1,500 pcm","College Close, Great Casterton, Stamford PE9",4 bed detached house to rent,Listed on 14th Apr 2023
1425,Lincolnshire,listing_64432176,"£1,500 pcm","Harston Road, Denton, Grantham NG32",2 bed detached house to rent,Listed on 19th Apr 2023
1426,Lincolnshire,listing_64538748,"£1,700 pcm","Chapel Lane, Folkingham NG34",5 bed detached house to rent,Listed on 3rd May 2023
1427,Lincolnshire,listing_64667223,"£1,750 pcm","Main Street, Branston NG32",4 bed cottage to rent,Listed on 19th May 2023
1428,Lincolnshire,listing_64658859,"£1,800 pcm","North Parade, Grantham NG31",5 bed town house to rent,Listed on 18th May 2023
1429,Lincolnshire,listing_39005696,"£2,150 pcm","Slate Drift, Collyweston, Stamford PE9",4 bed detached house to rent,Listed on 25th Apr 2023
1430,Lincolnshire,listing_64294173,"£2,384 pcm","Blundell Avenue, Cleethorpes DN35",10 bed terraced house to rent,Listed on 30th Mar 2023
1431,Lincolnshire,listing_63525655,"£2,750 pcm","Thompsons Bottom, Temple Bruer, Lincoln LN5",6 bed detached house to rent,Listed on 25th Dec 2022
1432,Lincolnshire,listing_64186459,"£3,000 pcm","Kirstal Close, Lincoln LN2",4 bed terraced house to rent,Listed on 15th Mar 2023
1433,Merseyside,listing_64860140,£395 pcm,"Cambria Street, Liverpool L6",1 bed property to rent,Listed on 13th Jun 2023
1434,Merseyside,listing_62865303,£403 pcm,"Liberty Street, Liverpool L15",1 bed property to rent,Listed on 11th Nov 2022
1435,Merseyside,listing_59818020,£425 pcm,"Room 3, Litherland Road, Bootle, Merseyside L20",Studio to rent,Listed on 28th Sep 2021
1436,Merseyside,listing_64735929,£430 pcm,"Gwladys Street, Liverpool L4",1 bed property to rent,Listed on 29th May 2023
1437,Merseyside,listing_64860142,£450 pcm,"Cambria Street, Liverpool L6",1 bed property to rent,Listed on 13th Jun 2023
1438,Merseyside,listing_63745263,£477 pcm,"Hartington Road, Toxteth, Liverpool L8",1 bed property to rent,Listed on 17th Jan 2023
1439,Merseyside,listing_64441358,£477 pcm,"Willowdale Road, Mossley Hill, Liverpool L18",1 bed property to rent,Listed on 20th Apr 2023
1440,Merseyside,listing_64860127,£495 pcm,"Mirfield Street, Liverpool L6",1 bed property to rent,Listed on 13th Jun 2023
1441,Merseyside,listing_64749851,£595 pcm,"Prior Street, Bootle L20",2 bed terraced house to rent,Listed on 31st May 2023
1442,Merseyside,listing_64859371,£625 pcm,"Elmtree Grove, Prenton CH43",2 bed semi-detached house to rent,Listed on 13th Jun 2023
1443,Merseyside,listing_64862836,£700 pcm,"Croxteth Grove, Liverpool L8",2 bed flat to rent,Listed on 13th Jun 2023
1444,Merseyside,listing_64501085,£725 pcm,"Duke Street, Liverpool L1",Studio to rent,Listed on 27th Apr 2023
1445,Merseyside,listing_62860621,£750 pcm,"Waterloo Road, Birkdale, Southport PR8",2 bed flat to rent,Listed on 7th Jun 2023
1446,Merseyside,listing_64876338,£775 pcm,"Gentwood Road, Liverpool L36",3 bed terraced house to rent,Listed on 14th Jun 2023
1447,Merseyside,listing_64707856,£800 pcm,"Glamis Road, Liverpool L13",2 bed terraced house to rent,Listed on 24th May 2023
1448,Merseyside,listing_64835019,£800 pcm,"Griffin Close, Croxteth, Liverpool L11",3 bed semi-detached house to rent,Listed on 9th Jun 2023
1449,Merseyside,listing_64854953,£800 pcm,"Abingdon Grove, Walton, Liverpool L4",3 bed end terrace house to rent,Listed on 12th Jun 2023
1450,Merseyside,listing_64493582,£825 pcm,"Lowden Avenue, Liverpool L21",3 bed terraced house to rent,Listed on 26th Apr 2023
1451,Merseyside,listing_59942127,£850 pcm,"31 Ullet Road, Liverpool L17",1 bed flat to rent,Listed on 6th Jun 2023
1452,Merseyside,listing_61185854,£850 pcm,"Witley Close, Moreton, Wirral CH46",3 bed terraced house to rent,Listed on 13th May 2023
1453,Merseyside,listing_64789366,£850 pcm,"Fleet Street, Liverpool L1",1 bed flat to rent,Listed on 5th Jun 2023
1454,Merseyside,listing_64811724,£850 pcm,"Standish Street, Liverpool L3",2 bed flat to rent,Listed on 7th Jun 2023
1455,Merseyside,listing_64851734,£850 pcm,"Maxton Road, Liverpool L6",3 bed terraced house to rent,Listed on 12th Jun 2023
1456,Merseyside,listing_64618751,£895 pcm,"Wyndham Road, Wallasey CH45",3 bed property to rent,Listed on 13th May 2023
1457,Merseyside,listing_64802896,£900 pcm,"Portman Road, Wavertree, Liverpool L15",3 bed terraced house to rent,Listed on 6th Jun 2023
1458,Merseyside,listing_64872838,£900 pcm,"Larchfield Road, Liverpool L23",3 bed terraced house to rent,Listed on 14th Jun 2023
1459,Merseyside,listing_63862233,£910 pcm,"Ground Floor, Liverpool L1",Studio to rent,Listed on 1st Feb 2023
1460,Merseyside,listing_64755920,£925 pcm,"Pall Mall, Liverpool L3",2 bed flat to rent,Listed on 31st May 2023
1461,Merseyside,listing_63770237,£950 pcm,"Brierfield Road, Liverpool L15",3 bed terraced house to rent,Listed on 20th Jan 2023
1462,Merseyside,listing_64735923,£950 pcm,"Florentine Rd, Liverpool L13",3 bed terraced house to rent,Listed on 29th May 2023
1463,Merseyside,listing_64765981,£950 pcm,"Bligh Street, Liverpool L15",2 bed detached house to rent,Listed on 1st Jun 2023
1464,Merseyside,listing_64784822,£950 pcm,"Hartington Road, Liverpool L12",3 bed terraced house to rent,Listed on 4th Jun 2023
1465,Merseyside,listing_64868451,£950 pcm,"The Lexington, Liverpool L3",Studio to rent,Listed on 14th Jun 2023
1466,Merseyside,listing_64666106,£975 pcm,"The Lexington, Liverpool L3",Studio to rent,Listed on 19th May 2023
1467,Merseyside,listing_64779880,£975 pcm,"Mostyn Avenue, Old Roan, Liverpool L10",3 bed semi-detached house to rent,Listed on 3rd Jun 2023
1468,Merseyside,listing_64826273,£985 pcm,"Jacob Street, Liverpool L8",2 bed flat to rent,Listed on 8th Jun 2023
1469,Merseyside,listing_64758050,"£1,000 pcm","Landseer Road, Liverpool L5",2 bed semi-detached house to rent,Listed on 1st Jun 2023
1470,Merseyside,listing_64854848,"£1,015 pcm","Jacob Street, Liverpool L8",2 bed flat to rent,Listed on 12th Jun 2023
1471,Merseyside,listing_64437304,"£1,045 pcm","Bethel Grove, Liverpool L17",3 bed flat to rent,Listed on 19th Apr 2023
1472,Merseyside,listing_64789377,"£1,050 pcm","Fleet Street, Liverpool L1",2 bed flat to rent,Listed on 5th Jun 2023
1473,Merseyside,listing_64281335,"£1,100 pcm","Ullet Road, Liverpool L8",2 bed flat to rent,Listed on 28th Mar 2023
1474,Merseyside,listing_64794023,"£1,200 pcm","Lee Vale Road, Liverpool L25",4 bed terraced house to rent,Listed on 5th Jun 2023
1475,Merseyside,listing_64869224,"£1,250 pcm","Baltic Yard, Blundell Street, Liverpool L1",2 bed flat to rent,Listed on 14th Jun 2023
1476,Merseyside,listing_64832814,"£1,260 pcm","Baltic Yard, Blundell Street, Liverpool L1",2 bed flat to rent,Listed on 9th Jun 2023
1477,Merseyside,listing_64869210,"£1,260 pcm","Baltic Yard, Blundell Street, Liverpool L1",2 bed flat to rent,Listed on 14th Jun 2023
1478,Merseyside,listing_64807561,"£1,300 pcm","Strand Street, Liverpool L1",2 bed flat to rent,Listed on 7th Jun 2023
1479,Merseyside,listing_64840102,"£1,300 pcm","Mariners Road, Liverpool L23",2 bed detached house to rent,Listed on 10th Jun 2023
1480,Merseyside,listing_64869220,"£1,300 pcm","Baltic Yard, Blundell Street, Liverpool L1",2 bed flat to rent,Listed on 14th Jun 2023
1481,Merseyside,listing_64334992,"£1,350 pcm","Alexandra Tower, Liverpool L3",2 bed flat to rent,Listed on 4th Apr 2023
1482,Merseyside,listing_64776241,"£1,350 pcm","Strand Street, Liverpool L1",2 bed flat to rent,Listed on 2nd Jun 2023
1483,Merseyside,listing_64779382,"£1,350 pcm","Strand Street, Liverpool L1",2 bed flat to rent,Listed on 2nd Jun 2023
1484,Merseyside,listing_64779383,"£1,350 pcm","Strand Street, Liverpool L1",2 bed flat to rent,Listed on 2nd Jun 2023
1485,Merseyside,listing_64794159,"£1,350 pcm","Strand Street, Liverpool L1",2 bed flat to rent,Listed on 5th Jun 2023
1486,Merseyside,listing_64869372,"£1,350 pcm","Baltic Yard, Blundell Street, Liverpool L1",2 bed flat to rent,Listed on 14th Jun 2023
1487,Merseyside,listing_64874239,"£1,395 pcm","Strand Street, Liverpool L1",2 bed flat to rent,Listed on 14th Jun 2023
1488,Merseyside,listing_64724637,"£1,400 pcm","Strand Street, Liverpool L1",2 bed flat to rent,Listed on 26th May 2023
1489,Merseyside,listing_64734974,"£1,400 pcm","The Lexington, Liverpool L3",1 bed flat to rent,Listed on 29th May 2023
1490,Merseyside,listing_64866918,"£1,400 pcm","Liverpool, Liverpool L13",4 bed terraced house to rent,Listed on 14th Jun 2023
1491,Merseyside,listing_64877685,"£1,400 pcm","Spinney Houses, Church Street, Liverpool L1",2 bed flat to rent,Listed on 15th Jun 2023
1492,Merseyside,listing_64724517,"£1,450 pcm","Strand Street, Liverpool L1",2 bed flat to rent,Listed on 26th May 2023
1493,Merseyside,listing_64834344,"£1,450 pcm","Kelvin Grove, Liverpool L8",5 bed terraced house to rent,Listed on 9th Jun 2023
1494,Merseyside,listing_64779386,"£1,475 pcm","Strand Street, Liverpool L1",2 bed flat to rent,Listed on 2nd Jun 2023
1495,Merseyside,listing_64696388,"£1,500 pcm","Windermere House, Liverpool L17",2 bed flat to rent,Listed on 23rd May 2023
1496,Merseyside,listing_64854213,"£1,500 pcm","Spinney Houses, Church Street, Liverpool L1",2 bed flat to rent,Listed on 12th Jun 2023
1497,Merseyside,listing_64807450,"£1,550 pcm","Spinney Houses, Church Street, Liverpool L1",2 bed flat to rent,Listed on 7th Jun 2023
1498,Merseyside,listing_64868678,"£1,550 pcm","The Lexington, Liverpool L3",1 bed flat to rent,Listed on 14th Jun 2023
1499,Merseyside,listing_64725502,"£1,575 pcm","Strand Street, Liverpool L1",2 bed flat to rent,Listed on 31st May 2023
1500,Merseyside,listing_63872876,"£1,600 pcm","3 Bed - 2nd Floor Apartment, Gibson House, New Brighton CH44",3 bed flat to rent,Listed on 3rd Feb 2023
1501,Merseyside,listing_64641468,"£1,600 pcm","Princes Parade, Liverpool L3",2 bed flat to rent,Listed on 16th May 2023
1502,Merseyside,listing_64868675,"£1,685 pcm","The Lexington, Liverpool L3",2 bed flat to rent,Listed on 14th Jun 2023
1503,Merseyside,listing_64879141,"£1,750 pcm","The Lexington, Liverpool L3",2 bed flat to rent,Listed on 15th Jun 2023
1504,Merseyside,listing_62151459,"£1,875 pcm","Briars Lane, Liverpool, Merseyside L31",4 bed semi-detached house to rent,Listed on 12th May 2023
1505,Merseyside,listing_64677218,"£2,000 pcm","Strand Street, Liverpool L1",3 bed flat to rent,Listed on 21st May 2023
1506,Merseyside,listing_64798686,"£2,000 pcm","Strand Street, Liverpool L1",3 bed flat to rent,Listed on 6th Jun 2023
1507,Merseyside,listing_64836854,"£2,000 pcm","Beresford Road, Liverpool L8",3 bed flat to rent,Listed on 10th Jun 2023
1508,Merseyside,listing_64735874,"£2,050 pcm","Clough Road, Liverpool L24",6 bed semi-detached house to rent,Listed on 29th May 2023
1509,Merseyside,listing_64825545,"£2,050 pcm","Beech Lane, Liverpool L18",5 bed semi-detached house to rent,Listed on 8th Jun 2023
1510,Merseyside,listing_64877686,"£2,072 pcm","Spinney Houses, Church Street, Liverpool L1",3 bed flat to rent,Listed on 15th Jun 2023
1511,Merseyside,listing_59457487,"£2,214 pcm","Fairclough Street, Liverpool L1",Studio to rent,Listed on 10th Oct 2022
1512,Merseyside,listing_64630566,"£2,550 pcm","Dacy Road, Liverpool L5",6 bed flat to rent,Listed on 16th May 2023
1513,Merseyside,listing_57715857,"£2,974 pcm","Keel Wharf, Liverpool L3",Studio to rent,Listed on 15th May 2021
1514,Merseyside,listing_64836855,"£3,000 pcm","Chirkdale Street, Liverpool L4",5 bed flat to rent,Listed on 10th Jun 2023
1515,Merseyside,listing_64836856,"£3,150 pcm","Hall Lane, Liverpool L9",6 bed flat to rent,Listed on 10th Jun 2023
1516,Merseyside,listing_64755975,"£3,575 pcm","Princess Dock, Liverpool L3",2 bed flat to rent,Listed on 31st May 2023
1517,Merseyside,listing_57715859,"£3,965 pcm","Keel Wharf, Liverpool L3",1 bed flat to rent,Listed on 6th Apr 2023
1518,Merseyside,listing_64296519,"£4,750 pcm","Three Acres Close, Woolton, Liverpool L25",7 bed detached house to rent,Listed on 30th Mar 2023
1519,Merseyside,listing_64735883,"£5,950 pcm","Albert Road, Formby, Liverpool L37",7 bed detached house to rent,Listed on 29th May 2023
1520,Norfolk,listing_64687338,£650 pcm,"Castle Street, Thetford IP24",1 bed terraced house to rent,Listed on 23rd May 2023
1521,Norfolk,listing_64870635,£650 pcm,"Queens Place, Mill Road, Great Yarmouth NR31",2 bed terraced house to rent,Listed on 14th Jun 2023
1522,Norfolk,listing_64872766,£700 pcm,"Havelock Road, Great Yarmouth NR30",2 bed terraced house to rent,Listed on 14th Jun 2023
1523,Norfolk,listing_62602392,£725 pcm,"King Street, Norwich NR1",Studio to rent,Listed on 20th May 2023
1524,Norfolk,listing_63824368,£781 pcm,"Heacham Bottom, Lynn Road, Snettisham, King's Lynn PE31",2 bed cottage to rent,Listed on 27th Jan 2023
1525,Norfolk,listing_64781724,£800 pcm,"A Red Lion Street, Aylsham NR12",2 bed flat to rent,Listed on 3rd Jun 2023
1526,Norfolk,listing_58444220,£850 pcm,"St Leonards Road, Norwich NR1",2 bed flat to rent,Listed on 8th Jun 2023
1527,Norfolk,listing_64855688,£900 pcm,"Elm Road, Norfolk, Upper Marham PE33",3 bed terraced house to rent,Listed on 12th Jun 2023
1528,Norfolk,listing_64878578,£950 pcm,"The Street, Costessey, Norwich NR8",2 bed semi-detached house to rent,Listed on 15th Jun 2023
1529,Norfolk,listing_61469985,"£1,000 pcm","King Street, Norwich NR1",2 bed flat to rent,Listed on 5th May 2023
1530,Norfolk,listing_64259366,"£1,000 pcm","King Street, Norwich NR1",2 bed flat to rent,Listed on 24th Mar 2023
1531,Norfolk,listing_58946730,"£1,050 pcm","Mountergate, Norwich NR1",2 bed flat to rent,Listed on 5th Jun 2023
1532,Norfolk,listing_59917206,"£1,050 pcm","King Street, Norwich NR1",2 bed flat to rent,Listed on 24th Mar 2023
1533,Norfolk,listing_64729769,"£1,050 pcm","Grant Street, Norwich NR2",3 bed terraced house to rent,Listed on 27th May 2023
1534,Norfolk,listing_62630363,"£1,100 pcm","Stewart Close, Tibenham, Norwich NR16",2 bed bungalow to rent,Listed on 20th Apr 2023
1535,Norfolk,listing_64841812,"£1,200 pcm","Reeve Way, Wymondham NR18",3 bed end terrace house to rent,Listed on 12th Jun 2023
1536,Norfolk,listing_64851746,"£1,200 pcm","Sussex Street, Norwich NR3",3 bed terraced house to rent,Listed on 12th Jun 2023
1537,Norfolk,listing_64452864,"£1,250 pcm","Holt Road, Wood Norton, Dereham NR20",2 bed detached bungalow to rent,Listed on 21st Apr 2023
1538,Norfolk,listing_64024996,"£1,270 pcm","Staithe Gardens, Norwich NR12",1 bed flat to rent,Listed on 23rd Feb 2023
1539,Norfolk,listing_58463889,"£1,275 pcm","St. Ann Lane, Norwich NR1",2 bed flat to rent,Listed on 15th Apr 2023
1540,Norfolk,listing_64005499,"£1,275 pcm","Holt Road, Cawston, Norwich NR10",2 bed terraced house to rent,Listed on 22nd Feb 2023
1541,Norfolk,listing_64829294,"£1,275 pcm","Holt Road, Cawston, Norwich NR10",2 bed semi-detached house to rent,Listed on 9th Jun 2023
1542,Norfolk,listing_64503122,"£1,300 pcm","Kittens Lane, Loddon, Norwich, Norfolk NR14",4 bed end terrace house to rent,Listed on 27th Apr 2023
1543,Norfolk,listing_64804939,"£1,300 pcm","Cartmel, Norfolk NR9",3 bed end terrace house to rent,Listed on 6th Jun 2023
1544,Norfolk,listing_64024993,"£1,310 pcm","Staithe Gardens, Norwich NR12",1 bed flat to rent,Listed on 23rd Feb 2023
1545,Norfolk,listing_53183096,"£1,350 pcm","Short Green, Winfarthing, Diss IP22",4 bed farmhouse to rent,Listed on 12th Jun 2023
1546,Norfolk,listing_59464672,"£1,400 pcm","Lodge Road, Feltwell IP26",4 bed detached house to rent,Listed on 27th May 2022
1547,Norfolk,listing_64779325,"£1,400 pcm","Stafford Street, Norwich NR2",2 bed terraced house to rent,Listed on 2nd Jun 2023
1548,Norfolk,listing_64024997,"£1,405 pcm","Staithe Gardens, Norwich NR12",1 bed flat to rent,Listed on 23rd Feb 2023
1549,Norfolk,listing_64782546,"£1,450 pcm","Cross Street, Cromer NR27",3 bed semi-detached house to rent,Listed on 3rd Jun 2023
1550,Norfolk,listing_64839525,"£1,500 pcm","Long Stratton Road, Forncett St. Peter, Norwich NR16",3 bed barn conversion to rent,Listed on 10th Jun 2023
1551,Norfolk,listing_64811669,"£1,585 pcm","Norwich Road, Norwich NR15",4 bed detached house to rent,Listed on 7th Jun 2023
1552,Norfolk,listing_41397012,"£1,600 pcm","Dereham Road, Scarning, Dereham NR19",3 bed cottage to rent,Listed on 12th Nov 2022
1553,Norfolk,listing_58463888,"£1,600 pcm","St. Ann Lane, Norwich NR1",2 bed flat to rent,Listed on 23rd Feb 2023
1554,Norfolk,listing_64548426,"£1,600 pcm","Northfields, Norwich NR4",4 bed terraced house to rent,Listed on 4th May 2023
1555,Norfolk,listing_64670900,"£2,000 pcm","Candlers Lane, Harleston IP20",2 bed semi-detached house to rent,Listed on 19th May 2023
1556,Norfolk,listing_64696393,"£2,200 pcm","Thatched Cottage, Sustead, Norwich NR11",4 bed detached house to rent,Listed on 23rd May 2023
1557,Norfolk,listing_64725399,"£2,300 pcm","Rectory Road, Edgefield, Melton Constable NR24",4 bed detached house to rent,Listed on 26th May 2023
1558,Norfolk,listing_64682629,"£3,500 pcm","Brandon Road, Methwold IP26",6 bed detached house to rent,Listed on 22nd May 2023
1559,Northamptonshire,listing_47949182,£325 pcm,"Kestrel Lane, Wellingborough NN8",1 bed flat to rent,Listed on 10th Jun 2023
1560,Northamptonshire,listing_45110222,£350 pcm,"Kestrel Lane, Wellingborough NN8",1 bed flat to rent,Listed on 7th Jun 2023
1561,Northamptonshire,listing_47020136,£375 pcm,"Kestrel Lane, Wellingborough NN8",1 bed flat to rent,Listed on 2nd Jun 2023
1562,Northamptonshire,listing_55998962,£410 pcm,"Palk Road, Wellingborough NN8",1 bed flat to rent,Listed on 8th Jun 2023
1563,Northamptonshire,listing_58038225,£410 pcm,"Regent Street, Kettering NN16",1 bed flat to rent,Listed on 5th Jun 2023
1564,Northamptonshire,listing_45036647,£425 pcm,"Bern Links, Northampton NN4",1 bed flat to rent,Listed on 12th Jun 2023
1565,Northamptonshire,listing_46531918,£435 pcm,"Althorp Road, Northampton NN5",Studio to rent,Listed on 5th Jun 2023
1566,Northamptonshire,listing_47967895,£450 pcm,"Kestrel Lane, Wellingborough NN8",1 bed flat to rent,Listed on 17th Apr 2023
1567,Northamptonshire,listing_49148700,£525 pcm,"Park Mews, Wellingborough NN8",1 bed flat to rent,Listed on 14th Jun 2023
1568,Northamptonshire,listing_44172586,£550 pcm,"Ermine Road, Northampton NN3",1 bed flat to rent,Listed on 28th Apr 2023
1569,Northamptonshire,listing_64875706,£550 pcm,"Swinburne Road, Wellingborough NN8",1 bed flat to rent,Listed on 14th Jun 2023
1570,Northamptonshire,listing_64860178,£600 pcm,"Brackley, Brackley NN13",2 bed mobile/park home to rent,Listed on 13th Jun 2023
1571,Northamptonshire,listing_34041709,£650 pcm,"High Street, Weedon, Northants NN7",1 bed flat to rent,Listed on 12th Jun 2023
1572,Northamptonshire,listing_44589043,£650 pcm,"Thomas Street, Wellingborough NN8",1 bed flat to rent,Listed on 12th Jun 2023
1573,Northamptonshire,listing_34534938,£675 pcm,"Plough Close, Lang Farm, Daventry NN11",2 bed flat to rent,Listed on 6th Jun 2023
1574,Northamptonshire,listing_61314811,£695 pcm,"Birch Road, Rushden NN10",1 bed flat to rent,Listed on 3rd Jun 2023
1575,Northamptonshire,listing_31754905,£725 pcm,"Fitzroy Court, West Haddon, Northampton NN6",2 bed flat to rent,Listed on 9th Jun 2023
1576,Northamptonshire,listing_64836019,£750 pcm,"Bowland Drive, Barton Seagrave, Kettering NN15",1 bed terraced house to rent,Listed on 9th Jun 2023
1577,Northamptonshire,listing_64614564,£795 pcm,"Greenhill Rise, Corby NN18",2 bed flat to rent,Listed on 12th May 2023
1578,Northamptonshire,listing_59406760,£825 pcm,"Betony Walk, Rushden NN10",2 bed semi-detached house to rent,Listed on 13th Jun 2023
1579,Northamptonshire,listing_64833176,£850 pcm,"Oldenburg Road, Corby NN18",2 bed property to rent,Listed on 9th Jun 2023
1580,Northamptonshire,listing_64853174,£850 pcm,"Old Forge Drive, West Haddon, Northampton NN6",2 bed terraced house to rent,Listed on 12th Jun 2023
1581,Northamptonshire,listing_64854338,£850 pcm,"Kilnway, Wellingborough NN8",3 bed terraced house to rent,Listed on 12th Jun 2023
