,County,Property ID,Price per month,Address,Property Description,Date of Listing
790,Greater Manchester,listing_64820708,£900 pcm,"Clarence Road, Manchester M13",1 bed flat to rent,Listed on 8th Jun 2023
791,Greater Manchester,listing_64865383,£900 pcm,"Shire Gardens, Bury M26",3 bed semi-detached house to rent,Listed on 13th Jun 2023
792,Greater Manchester,listing_57091043,£925 pcm,"Town Hall, Bexley Square, Salford, Manchester M3",Studio to rent,Listed on 23rd May 2023
793,Greater Manchester,listing_64755973,£950 pcm,"Northill Apartments, Salford M50",1 bed flat to rent,Listed on 31st May 2023
794,Greater Manchester,listing_64872795,£950 pcm,"Stafford Road, Swinton, Manchester M27",3 bed terraced house to rent,Listed on 14th Jun 2023
795,Greater Manchester,listing_64878610,£950 pcm,"Tib Street, Manchester M4",1 bed flat to rent,Listed on 15th Jun 2023
796,Greater Manchester,listing_64876312,£995 pcm,"Wildbrook Grove, Little Hulton, Manchester M38",3 bed semi-detached house to rent,Listed on 14th Jun 2023
797,Greater Manchester,listing_64794576,"£1,000 pcm","Chapman Street, Manchester M18",3 bed terraced house to rent,Listed on 5th Jun 2023
798,Greater Manchester,listing_64862827,"£1,000 pcm","Oak Street, Shawforth, Rochdale OL12",3 bed semi-detached house to rent,Listed on 13th Jun 2023
799,Greater Manchester,listing_57973590,"£1,025 pcm","Town Hall, Bexley Square, Salford, Manchester M3",1 bed flat to rent,Listed on 13th Jun 2023
800,Greater Manchester,listing_64877078,"£1,025 pcm","Walkden Road, Manchester M28",3 bed terraced house to rent,Listed on 15th Jun 2023
801,Greater Manchester,listing_60865533,"£1,050 pcm","Wharf End, Trafford Park, Manchester M17",1 bed flat to rent,Listed on 14th Jun 2023
802,Greater Manchester,listing_64862445,"£1,050 pcm","Rishworth Close, Offerton, Stockport SK2",3 bed semi-detached house to rent,Listed on 13th Jun 2023
803,Greater Manchester,listing_64604540,"£1,075 pcm","Weymouth Road, Eccles, Manchester M30",3 bed semi-detached house to rent,Listed on 11th May 2023
804,Greater Manchester,listing_64799614,"£1,075 pcm","The Quays, Salford M50",1 bed flat to rent,Listed on 6th Jun 2023
805,Greater Manchester,listing_64554227,"£1,095 pcm","Foxhill Road, Eccles M30",3 bed semi-detached house to rent,Listed on 5th May 2023
806,Greater Manchester,listing_64572299,"£1,100 pcm","New Kings Head Yard, Salford M3",1 bed flat to rent,Listed on 8th May 2023
807,Greater Manchester,listing_64651019,"£1,100 pcm","Stancliffe Road, Manchester M22",3 bed semi-detached house to rent,Listed on 17th May 2023
808,Greater Manchester,listing_64808802,"£1,100 pcm","Willingdon Drive, Prestwich, Manchester M25",3 bed semi-detached house to rent,Listed on 7th Jun 2023
809,Greater Manchester,listing_64782541,"£1,150 pcm","The Heart, Media City Uk, Salford M50",2 bed flat to rent,Listed on 3rd Jun 2023
810,Greater Manchester,listing_64814146,"£1,150 pcm","Sakina House, Manchester M20",1 bed flat to rent,Listed on 7th Jun 2023
811,Greater Manchester,listing_64875621,"£1,150 pcm","Manchester, Wythenshaw M22",3 bed semi-detached house to rent,Listed on 14th Jun 2023
812,Greater Manchester,listing_64657247,"£1,200 pcm","Pilkington Road, Kearsley, Bolton BL4",3 bed semi-detached house to rent,Listed on 18th May 2023
813,Greater Manchester,listing_64817008,"£1,200 pcm","Whitekirk Drive, Failsworth, Manchester M35",3 bed terraced house to rent,Listed on 8th Jun 2023
814,Greater Manchester,listing_64824405,"£1,200 pcm","Riley Bank Road, Leigh WN7",3 bed semi-detached house to rent,Listed on 8th Jun 2023
815,Greater Manchester,listing_64875698,"£1,200 pcm","Horrocks Road, Turton, Bolton BL7",3 bed detached house to rent,Listed on 14th Jun 2023
816,Greater Manchester,listing_64877079,"£1,200 pcm","Balsam Close, Manchester M13",2 bed terraced house to rent,Listed on 15th Jun 2023
817,Greater Manchester,listing_64446181,"£1,250 pcm","Arches, Whitworth Street West, Manchester M1",Studio to rent,Listed on 20th Apr 2023
818,Greater Manchester,listing_64693742,"£1,250 pcm","Lakehouse, Manchester M15",2 bed flat to rent,Listed on 23rd May 2023
819,Greater Manchester,listing_64697885,"£1,250 pcm","Thurcaston Road, West Timperley, Altrincham WA14",2 bed flat to rent,Listed on 23rd May 2023
820,Greater Manchester,listing_64707349,"£1,250 pcm","Fairway, Pendlebury, Swinton, Manchester M27",3 bed semi-detached house to rent,Listed on 24th May 2023
821,Greater Manchester,listing_64827515,"£1,250 pcm","Belgravia Gardens, Manchester M21",2 bed terraced house to rent,Listed on 9th Jun 2023
822,Greater Manchester,listing_64878062,"£1,250 pcm","Deansgate, Bolton BL1",2 bed flat to rent,Listed on 15th Jun 2023
823,Greater Manchester,listing_64771557,"£1,285 pcm","Corporation Street, Manchester M4",1 bed flat to rent,Listed on 6th Jun 2023
824,Greater Manchester,listing_64767336,"£1,300 pcm","Arches, Whitworth Street West, Manchester M1",Studio to rent,Listed on 1st Jun 2023
825,Greater Manchester,listing_64821737,"£1,300 pcm","Chevron Close, Salford M6",4 bed terraced house to rent,Listed on 8th Jun 2023
826,Greater Manchester,listing_64721365,"£1,320 pcm","The Quays, Salford M50",2 bed flat to rent,Listed on 26th May 2023
827,Greater Manchester,listing_64875742,"£1,325 pcm","Old Mill, Manchester M28",4 bed semi-detached house to rent,Listed on 14th Jun 2023
828,Greater Manchester,listing_64814147,"£1,350 pcm","Sakina House, Manchester M20",2 bed flat to rent,Listed on 7th Jun 2023
829,Greater Manchester,listing_64869222,"£1,375 pcm","Botanica, Chester Road, Manchester M15",2 bed flat to rent,Listed on 14th Jun 2023
830,Greater Manchester,listing_64644462,"£1,390 pcm","Aytoun Street, Manchester M1",1 bed flat to rent,Listed on 17th May 2023
831,Greater Manchester,listing_63873873,"£1,400 pcm","Arches, Whitworth Street West, Manchester M1",1 bed flat to rent,Listed on 3rd Feb 2023
832,Greater Manchester,listing_64602460,"£1,400 pcm","Exmouth Road, Sale M33",3 bed terraced house to rent,Listed on 11th May 2023
833,Greater Manchester,listing_64841888,"£1,450 pcm","Whitworth Street West, Manchester M1",2 bed flat to rent,Listed on 12th Jun 2023
834,Greater Manchester,listing_64851629,"£1,450 pcm","New Kings Head Yard, Salford M3",2 bed flat to rent,Listed on 12th Jun 2023
835,Greater Manchester,listing_64866925,"£1,450 pcm","Eastbank Tower, Manchester M4",2 bed flat to rent,Listed on 14th Jun 2023
836,Greater Manchester,listing_64869440,"£1,460 pcm","Botanica, Chester Road, Manchester M15",2 bed flat to rent,Listed on 14th Jun 2023
837,Greater Manchester,listing_64841859,"£1,485 pcm","Chester Road, Manchester M15",1 bed flat to rent,Listed on 12th Jun 2023
838,Greater Manchester,listing_64421327,"£1,489 pcm","Oxygen Tower Store Street, Manchester M1",1 bed flat to rent,Listed on 18th Apr 2023
839,Greater Manchester,listing_64798399,"£1,495 pcm","The Quay Loop Road, Salford Quays M50",2 bed flat to rent,Listed on 6th Jun 2023
840,Greater Manchester,listing_64849949,"£1,500 pcm","The Box Works, 4 Worsley Street, Castlefield, Manchester M15",2 bed flat to rent,Listed on 12th Jun 2023
841,Greater Manchester,listing_64869365,"£1,500 pcm","Botanica, Chester Road, Manchester M15",2 bed flat to rent,Listed on 14th Jun 2023
842,Greater Manchester,listing_64105034,"£1,575 pcm","The Quadrangle, Manchester M1",2 bed flat to rent,Listed on 6th Mar 2023
843,Greater Manchester,listing_64599943,"£1,575 pcm","Botanica, Chester Road, Manchester M15",2 bed flat to rent,Listed on 11th May 2023
844,Greater Manchester,listing_64770930,"£1,575 pcm","Chorlton Street, Manchester M1",1 bed flat to rent,Listed on 2nd Jun 2023
845,Greater Manchester,listing_64575411,"£1,580 pcm","Botanica, Chester Road, Manchester M15",2 bed flat to rent,Listed on 9th May 2023
846,Greater Manchester,listing_64869378,"£1,580 pcm","Botanica, Chester Road, Manchester M15",2 bed flat to rent,Listed on 14th Jun 2023
847,Greater Manchester,listing_63401417,"£1,600 pcm","Bowlee Close, Unsworth, Bury BL9",3 bed detached house to rent,Listed on 3rd Jun 2023
848,Greater Manchester,listing_64608279,"£1,650 pcm","Chorlton Street, Manchester M1",2 bed flat to rent,Listed on 12th May 2023
849,Greater Manchester,listing_64645210,"£1,650 pcm","Minshull Street, Manchester M1",2 bed flat to rent,Listed on 17th May 2023
850,Greater Manchester,listing_64803212,"£1,650 pcm",M4,2 bed flat to rent,Listed on 6th Jun 2023
851,Greater Manchester,listing_64858245,"£1,650 pcm","Minshull Street, Manchester M1",2 bed flat to rent,Listed on 13th Jun 2023
852,Greater Manchester,listing_64869377,"£1,650 pcm","Botanica, Chester Road, Manchester M15",2 bed flat to rent,Listed on 14th Jun 2023
853,Greater Manchester,listing_64869443,"£1,670 pcm","Botanica, Chester Road, Manchester M15",2 bed town house to rent,Listed on 14th Jun 2023
854,Greater Manchester,listing_64855610,"£1,750 pcm","St. Werburghs Road, Manchester M21",3 bed semi-detached house to rent,Listed on 12th Jun 2023
855,Greater Manchester,listing_64862937,"£1,750 pcm","Etchells Road, West Timperley, Altrincham WA14",3 bed semi-detached house to rent,Listed on 13th Jun 2023
856,Greater Manchester,listing_64644926,"£1,835 pcm","Aytoun Street, Manchester M1",2 bed flat to rent,Listed on 17th May 2023
857,Greater Manchester,listing_64869379,"£1,840 pcm","Botanica, Chester Road, Manchester M15",2 bed flat to rent,Listed on 14th Jun 2023
858,Greater Manchester,listing_64800227,"£1,880 pcm","The Quay Loop Road, Salford Quays M50",3 bed flat to rent,Listed on 6th Jun 2023
859,Greater Manchester,listing_63959442,"£1,900 pcm","Manchester Road, Chorlton-Cum-Hardy M21",Retail to rent,Listed on 15th Feb 2023
860,Greater Manchester,listing_64869376,"£1,900 pcm","Botanica, Chester Road, Manchester M15",3 bed flat to rent,Listed on 14th Jun 2023
861,Greater Manchester,listing_64869374,"£1,975 pcm","Botanica, Chester Road, Manchester M15",3 bed flat to rent,Listed on 14th Jun 2023
862,Greater Manchester,listing_64624171,"£1,990 pcm","Ardenfield Close, Radcliffe, Manchester M26",4 bed detached house to rent,Listed on 15th May 2023
863,Greater Manchester,listing_53949600,"£1,995 pcm","Deansgate Square, South Tower, Manchester M15",2 bed flat to rent,Listed on 13th Jun 2023
864,Greater Manchester,listing_64805036,"£2,000 pcm","Burton Road, Manchester M20",2 bed flat to rent,Listed on 6th Jun 2023
865,Greater Manchester,listing_64855946,"£2,000 pcm","Lockside Lane, Salford M5",2 bed flat to rent,Listed on 12th Jun 2023
866,Greater Manchester,listing_64820786,"£2,035 pcm","Middlewood Street, Salford M5",3 bed flat to rent,Listed on 8th Jun 2023
867,Greater Manchester,listing_64877053,"£2,095 pcm","Bolton Road, Swinton, Manchester M27",5 bed semi-detached house to rent,Listed on 15th Jun 2023
868,Greater Manchester,listing_64784267,"£2,100 pcm","Croom Walk, Manchester M40",4 bed end terrace house to rent,Listed on 4th Jun 2023
869,Greater Manchester,listing_64379370,"£2,125 pcm","Middlewood Street, Salford M5",3 bed flat to rent,Listed on 12th Apr 2023
870,Greater Manchester,listing_64676602,"£2,150 pcm","Hazelhurst Road, Manchester M28",4 bed semi-detached house to rent,Listed on 20th May 2023
871,Greater Manchester,listing_64379382,"£2,175 pcm","Middlewood Street, Salford M5",3 bed flat to rent,Listed on 12th Apr 2023
872,Greater Manchester,listing_64808938,"£2,190 pcm","Corporation Street, Manchester M4",3 bed flat to rent,Listed on 7th Jun 2023
873,Greater Manchester,listing_64758053,"£2,200 pcm","Sunnybank Road, Bowdon, Altrincham WA14",4 bed detached house to rent,Listed on 1st Jun 2023
874,Greater Manchester,listing_64392524,"£2,249 pcm","Albert Road East, Cheshire WA15",3 bed end terrace house to rent,Listed on 13th Apr 2023
875,Greater Manchester,listing_64869369,"£2,265 pcm","Botanica, Chester Road, Manchester M15",2 bed flat to rent,Listed on 14th Jun 2023
876,Greater Manchester,listing_64016932,"£2,295 pcm","Spinners Way, Manchester M15",1 bed flat to rent,Listed on 23rd Feb 2023
877,Greater Manchester,listing_64694044,"£2,325 pcm","Middlewood Street, Salford M5",3 bed flat to rent,Listed on 23rd May 2023
878,Greater Manchester,listing_61015785,"£2,358 pcm","Arundel Street, Manchester M15",1 bed flat to rent,Listed on 21st Jun 2022
879,Greater Manchester,listing_64294003,"£2,384 pcm","Wellington Road South, Stockport SK4",1 bed flat to rent,Listed on 30th Mar 2023
880,Greater Manchester,listing_61015786,"£2,490 pcm","Spinners Way, Manchester M15",1 bed flat to rent,Listed on 18th Mar 2022
881,Greater Manchester,listing_64834961,"£2,500 pcm","Oldham St, Manchester M4",1 bed flat to rent,Listed on 9th Jun 2023
882,Greater Manchester,listing_64834963,"£2,500 pcm","Oldham St, Manchester M4",1 bed flat to rent,Listed on 9th Jun 2023
883,Greater Manchester,listing_58426135,"£2,520 pcm","Middleton Road, Manchester M8",2 bed flat to rent,Listed on 10th Oct 2022
884,Greater Manchester,listing_64793379,"£2,525 pcm","Middlewood Street, Salford M5",3 bed flat to rent,Listed on 5th Jun 2023
885,Greater Manchester,listing_64294252,"£2,554 pcm","George Lane, Stockport SK6",1 bed town house to rent,Listed on 30th Mar 2023
886,Greater Manchester,listing_64303261,"£2,668 pcm","Stillwater Drive, Manchester M11",1 bed flat to rent,Listed on 31st Mar 2023
887,Greater Manchester,listing_64293624,"£2,781 pcm","Thirsfield Drive, Manchester M11",3 bed semi-detached house to rent,Listed on 30th Mar 2023
888,Greater Manchester,listing_64293952,"£2,781 pcm","Lampwick Lane, Manchester M4",1 bed flat to rent,Listed on 30th Mar 2023
889,Greater Manchester,listing_64303307,"£2,781 pcm","Ludgate Hill, Manchester M4",2 bed flat to rent,Listed on 31st Mar 2023
890,Greater Manchester,listing_64293577,"£2,895 pcm","Middlewood Street, Salford M5",2 bed flat to rent,Listed on 30th Mar 2023
891,Greater Manchester,listing_64836012,"£2,990 pcm","Michigan Point Tower A, Salford M50",2 bed flat to rent,Listed on 9th Jun 2023
892,Greater Manchester,listing_64648718,"£3,185 pcm","Crofton Street, Manchester M14",7 bed terraced house to rent,Listed on 17th May 2023
893,Greater Manchester,listing_64648756,"£3,200 pcm","William Chadwick Close, Manchester M40",4 bed semi-detached house to rent,Listed on 17th May 2023
894,Greater Manchester,listing_64303274,"£3,235 pcm","City Road East, Manchester M15",2 bed flat to rent,Listed on 31st Mar 2023
895,Greater Manchester,listing_64293764,"£3,349 pcm","Victoria Bridge Street, Salford M3",2 bed flat to rent,Listed on 30th Mar 2023
896,Greater Manchester,listing_60986005,"£3,390 pcm","Oldham Road, Manchester M4",1 bed flat to rent,Listed on 6th Apr 2023
897,Greater Manchester,listing_58589741,"£3,392 pcm","Church St, Manchester M4",Studio to rent,Listed on 6th Apr 2023
898,Greater Manchester,listing_58988948,"£3,400 pcm","Victoria Terrace, Manchester M12",4 bed flat to rent,Listed on 6th Apr 2023
899,Greater Manchester,listing_64503349,"£3,400 pcm","Hale, Hale, Altrincham WA15",3 bed detached house to rent,Listed on 27th Apr 2023
900,Greater Manchester,listing_58426202,"£3,500 pcm","Tewkesbury Road, Manchester M40",3 bed flat to rent,Listed on 6th Apr 2023
901,Greater Manchester,listing_64419806,"£3,500 pcm","Piccadilly Lofts, Manchester M1",2 bed flat to rent,Listed on 17th Apr 2023
902,Greater Manchester,listing_64610551,"£3,500 pcm","Hilton Street, Manchester M1",2 bed flat to rent,Listed on 12th May 2023
903,Greater Manchester,listing_64621222,"£3,650 pcm","Whiteoak View, Bolton BL3",2 bed terraced house to rent,Listed on 15th May 2023
904,Greater Manchester,listing_53328451,"£3,663 pcm","Church St, Manchester M4",1 bed flat to rent,Listed on 6th Apr 2023
905,Greater Manchester,listing_58091526,"£3,720 pcm","Oldham Road, Manchester M4",2 bed flat to rent,Listed on 6th Apr 2023
906,Greater Manchester,listing_58249056,"£3,720 pcm","Oldham Road, Manchester M4",2 bed flat to rent,Listed on 6th Apr 2023
907,Greater Manchester,listing_58637489,"£3,720 pcm","Oldham Road, Manchester M4",2 bed flat to rent,Listed on 6th Apr 2023
908,Greater Manchester,listing_60986001,"£3,720 pcm","Oldham Road, Manchester M4",2 bed flat to rent,Listed on 6th Apr 2023
909,Greater Manchester,listing_60986003,"£3,720 pcm","Oldham Road, Manchester M4",2 bed flat to rent,Listed on 6th Apr 2023
910,Greater Manchester,listing_64293900,"£3,746 pcm","Great Bridgewater Street, Manchester M1",2 bed flat to rent,Listed on 30th Mar 2023
911,Greater Manchester,listing_64293473,"£3,973 pcm","Cowesby Street, Manchester M14",4 bed terraced house to rent,Listed on 30th Mar 2023
912,Greater Manchester,listing_64293473,"£3,973 pcm","Cowesby Street, Manchester M14",4 bed terraced house to rent,Listed on 30th Mar 2023
913,Greater Manchester,listing_64749912,"£4,000 pcm","Garden Lane, Manchester M3",3 bed terraced house to rent,Listed on 31st May 2023
914,Greater Manchester,listing_53328458,"£4,059 pcm","Church St, Manchester M4",1 bed flat to rent,Listed on 6th Apr 2023
915,Greater Manchester,listing_64214640,"£4,500 pcm","Bolton Road Farnworth Bolton, Bolton BL4",8 bed terraced house to rent,Listed on 20th Mar 2023
916,Greater Manchester,listing_53328454,"£4,533 pcm","Church St, Manchester M4",1 bed flat to rent,Listed on 6th Apr 2023
917,Greater Manchester,listing_64841903,"£4,560 pcm","Rappax Road, Hale, Altringham Altrincham WA15",3 bed detached house to rent,Listed on 12th Jun 2023
918,Greater Manchester,listing_64293537,"£5,448 pcm","Princess Road, Manchester M14",6 bed terraced house to rent,Listed on 30th Mar 2023
919,Greater Manchester,listing_64519779,"£6,000 pcm","Clowes Street, Manchester M3",2 bed flat to rent,Listed on 29th Apr 2023
920,Greater Manchester,listing_64293448,"£6,129 pcm","Mauldeth Road West, Manchester M20",5 bed semi-detached house to rent,Listed on 30th Mar 2023
921,Greater Manchester,listing_64293503,"£6,583 pcm","Kedleston Avenue, Manchester M14",6 bed semi-detached house to rent,Listed on 30th Mar 2023
922,Hampshire,listing_64497825,£525 pcm,"161, Queens Road, Portsmouth, Hampshire PO2",1 bed town house to rent,Listed on 27th Apr 2023
923,Hampshire,listing_64308473,£550 pcm,"Smiths Quay Boat Yard, Southampton SO19",1 bed property to rent,Listed on 31st Mar 2023
924,Hampshire,listing_64381549,£675 pcm,"Manor Road, Portsmouth PO1",1 bed property to rent,Listed on 12th Apr 2023
925,Hampshire,listing_62608011,£700 pcm,"20, Gurney Road, Southampton, Hampshire SO15",1 bed town house to rent,Listed on 13th Jun 2023
926,Hampshire,listing_63977024,£700 pcm,"Paynes Road, Shirley, Southampton SO15",1 bed flat to rent,Listed on 17th Feb 2023
927,Hampshire,listing_64861386,£800 pcm,"Kent Road, Whitehill, Bordon GU35",1 bed detached house to rent,Listed on 13th Jun 2023
928,Hampshire,listing_64865079,£800 pcm,"Dean Road, Southampton SO18",Studio to rent,Listed on 13th Jun 2023
929,Hampshire,listing_60373010,£900 pcm,"Millbridge Gardens, Southampton SO19",1 bed maisonette to rent,Listed on 14th Dec 2021
930,Hampshire,listing_64876337,£900 pcm,"Sunlight Gardens, Fareham PO15",2 bed flat to rent,Listed on 14th Jun 2023
931,Hampshire,listing_64833442,£950 pcm,"Church Road, Nether Wallop SO20",1 bed bungalow to rent,Listed on 9th Jun 2023
932,Hampshire,listing_64743962,£975 pcm,"Burlington Road, Southampton SO15",1 bed terraced house to rent,Listed on 30th May 2023
933,Hampshire,listing_64815990,"£1,025 pcm","Cashmere Drive, Andover SP11",2 bed flat to rent,Listed on 7th Jun 2023
934,Hampshire,listing_59021052,"£1,100 pcm","Whitwell Road, Southsea PO4",2 bed flat to rent,Listed on 14th Jun 2023
935,Hampshire,listing_64774931,"£1,100 pcm","Lower Bartons, Fordingbridge SP6",2 bed bungalow to rent,Listed on 2nd Jun 2023
936,Hampshire,listing_64876356,"£1,100 pcm","Adams Road, Picket Piece, Andover SP11",2 bed terraced house to rent,Listed on 14th Jun 2023
937,Hampshire,listing_64747014,"£1,150 pcm","Charnwood Crescent, Chandler's Ford, Eastleigh SO53",2 bed maisonette to rent,Listed on 31st May 2023
938,Hampshire,listing_62476622,"£1,200 pcm","Campbell Close, Grateley SP11",2 bed semi-detached house to rent,Listed on 31st May 2023
939,Hampshire,listing_64794296,"£1,275 pcm","Centenary Plaza, Southampton SO19",1 bed flat to rent,Listed on 5th Jun 2023
940,Hampshire,listing_64854904,"£1,275 pcm","Crispins Crescent, Waterlooville PO7",2 bed terraced house to rent,Listed on 12th Jun 2023
941,Hampshire,listing_64378051,"£1,300 pcm","Cherry Tree Close, Farnborough GU14",3 bed terraced house to rent,Listed on 11th Apr 2023
942,Hampshire,listing_64825510,"£1,300 pcm","West Ham Close, Basingstoke RG22",3 bed terraced house to rent,Listed on 8th Jun 2023
943,Hampshire,listing_64842029,"£1,300 pcm","Aberdeen Road, Southampton SO17",2 bed terraced house to rent,Listed on 12th Jun 2023
944,Hampshire,listing_64849448,"£1,300 pcm","Balfour Road, Portsmouth PO2",3 bed terraced house to rent,Listed on 12th Jun 2023
945,Hampshire,listing_64860123,"£1,300 pcm","Wrights Walk, Southampton SO31",3 bed terraced house to rent,Listed on 13th Jun 2023
946,Hampshire,listing_64765355,"£1,310 pcm","Vantage Tower, Cenetary Plaza, Southampton SO19",1 bed flat to rent,Listed on 1st Jun 2023
947,Hampshire,listing_64856036,"£1,325 pcm","Topaz Drive, Andover SP10",3 bed end terrace house to rent,Listed on 12th Jun 2023
948,Hampshire,listing_64805295,"£1,329 pcm","Centenary Plaza, Southampton SO19",1 bed flat to rent,Listed on 6th Jun 2023
949,Hampshire,listing_64837201,"£1,350 pcm","Austen Road, Farnborough GU14",2 bed terraced house to rent,Listed on 10th Jun 2023
950,Hampshire,listing_64839046,"£1,350 pcm","Marlborough View, Farnborough GU14",2 bed semi-detached house to rent,Listed on 10th Jun 2023
951,Hampshire,listing_64861433,"£1,350 pcm","Amarylis Close, Titchfield Park PO15",3 bed terraced house to rent,Listed on 13th Jun 2023
952,Hampshire,listing_64864404,"£1,350 pcm","|Ref: R199197|, Honeysuckle Road, Southampton SO16",3 bed terraced bungalow to rent,Listed on 13th Jun 2023
953,Hampshire,listing_64863631,"£1,375 pcm","St Johns Road, Winchester SO23",2 bed terraced house to rent,Listed on 13th Jun 2023
954,Hampshire,listing_62209959,"£1,395 pcm","Alison Way, Aldershot, Hampshire GU11",2 bed semi-detached house to rent,Listed on 13th Jun 2023
955,Hampshire,listing_64736412,"£1,395 pcm","Megan Road, West End, Southampton SO30",3 bed semi-detached house to rent,Listed on 29th May 2023
956,Hampshire,listing_64725414,"£1,399 pcm","Catisfield Road, Southsea PO4",3 bed terraced house to rent,Listed on 26th May 2023
957,Hampshire,listing_47993192,"£1,400 pcm","Elm Grove Road, Farnborough, Hampshire GU14",3 bed terraced house to rent,Listed on 10th Jun 2023
958,Hampshire,listing_61717596,"£1,400 pcm","Wolseley Road, Aldershot GU11",2 bed terraced house to rent,Listed on 13th Jun 2023
959,Hampshire,listing_64688304,"£1,400 pcm","Blackberry Close, Clanfield, Waterlooville, Hampshire PO8",3 bed semi-detached house to rent,Listed on 23rd May 2023
960,Hampshire,listing_64834911,"£1,400 pcm","Hawk Close, Fareham PO14",3 bed semi-detached house to rent,Listed on 9th Jun 2023
961,Hampshire,listing_64872575,"£1,400 pcm","Cody Road, Farnborough GU14",3 bed terraced house to rent,Listed on 14th Jun 2023
962,Hampshire,listing_64613205,"£1,410 pcm","Centenary Plaza, Southampton SO19",1 bed flat to rent,Listed on 12th May 2023
963,Hampshire,listing_52478070,"£1,450 pcm","Quayside Road, Southampton SO18",3 bed detached house to rent,Listed on 13th Jun 2023
964,Hampshire,listing_64812840,"£1,450 pcm","Centenary Plaza, Southampton SO19",1 bed flat to rent,Listed on 7th Jun 2023
965,Hampshire,listing_64862167,"£1,450 pcm","Ash Close, Gosport PO12",4 bed town house to rent,Listed on 13th Jun 2023
966,Hampshire,listing_64613054,"£1,475 pcm","Centenary Plaza, Southampton SO19",1 bed flat to rent,Listed on 12th May 2023
967,Hampshire,listing_64630561,"£1,495 pcm","Withies Road, Gosport PO13",3 bed detached house to rent,Listed on 16th May 2023
968,Hampshire,listing_53403407,"£1,500 pcm","Othello Drive, Waterlooville PO7",3 bed terraced house to rent,Listed on 14th Jun 2023
969,Hampshire,listing_64594902,"£1,500 pcm","High View Road, Farnborough GU14",3 bed terraced house to rent,Listed on 11th May 2023
970,Hampshire,listing_64642890,"£1,500 pcm","Sarson Lane, Amport, Andover SP11",2 bed detached house to rent,Listed on 17th May 2023
971,Hampshire,listing_64740134,"£1,500 pcm","Station Road, Lymington SO41",3 bed semi-detached house to rent,Listed on 30th May 2023
972,Hampshire,listing_64865956,"£1,500 pcm","Anmore Road, Denmead, Waterlooville PO7",3 bed semi-detached house to rent,Listed on 13th Jun 2023
973,Hampshire,listing_64627890,"£1,550 pcm","Royal Gate, Southsea PO4",2 bed flat to rent,Listed on 15th May 2023
974,Hampshire,listing_64765949,"£1,550 pcm","Vinebank, Southampton SO18",3 bed detached house to rent,Listed on 1st Jun 2023
975,Hampshire,listing_64831847,"£1,595 pcm","York Terrace, Portsmouth PO2",3 bed semi-detached house to rent,Listed on 9th Jun 2023
976,Hampshire,listing_61108611,"£1,600 pcm","Cranwell Road, Farnborough GU14",3 bed terraced house to rent,Listed on 14th Jun 2023
977,Hampshire,listing_64515520,"£1,600 pcm","Georgia Close, Andover SP10",4 bed detached house to rent,Listed on 28th Apr 2023
978,Hampshire,listing_64805672,"£1,600 pcm","Britannia Road, Southsea PO5",4 bed terraced house to rent,Listed on 6th Jun 2023
979,Hampshire,listing_64456775,"£1,675 pcm","Bazeley Road, Waterlooville PO7",3 bed semi-detached house to rent,Listed on 21st Apr 2023
980,Hampshire,listing_62097081,"£1,700 pcm","4 Kings Crescent, Lymington SO41",4 bed detached house to rent,Listed on 1st Jun 2023
981,Hampshire,listing_64764723,"£1,700 pcm","High Street, Lee-On-The-Solent PO13",4 bed semi-detached house to rent,Listed on 1st Jun 2023
