,County,Property ID,Price per month,Address,Property Description,Date of Listing
0,Bath & N E Somerset,listing_64794678,£825 pcm,"Dudwell Lane, Chewton Mendip, Nr Radstock BA3",2 bed bungalow to rent,Listed on 5th Jun 2023
1,Bath & N E Somerset,listing_64829362,"£1,795 pcm","The Hollow, Bath BA2",2 bed semi-detached house to rent,Listed on 9th Jun 2023
2,Bath & N E Somerset,listing_61754783,"£2,000 pcm","Norfolk Buildings, Bath BA1",1 bed flat to rent,Listed on 14th Dec 2022
3,Bath & N E Somerset,listing_64697636,"£2,250 pcm","Old Brewery Place, Oakhill, Nr Radstock BA3",4 bed property to rent,Listed on 23rd May 2023
4,Bath & N E Somerset,listing_60256022,"£2,400 pcm","Norfolk Buildings, Bath BA1",1 bed flat to rent,Listed on 6th Apr 2023
5,Bath & N E Somerset,listing_61315341,"£3,000 pcm","Granville Court, Granville Road, Bath, Somerset BA1",3 bed flat to rent,Listed on 15th May 2023
6,Bath & N E Somerset,listing_64583364,£74 pcm,"Westfield Road, Frome, Somerset BA11",Parking to rent,Listed on 9th May 2023
7,Bath & N E Somerset,listing_64784825,£725 pcm,"Callington Road, Bristol BS4",1 bed property to rent,Listed on 4th Jun 2023
8,Bath & N E Somerset,listing_64856001,£825 pcm,"Locks Hill, Frome, Somerset BA11",1 bed flat to rent,Listed on 12th Jun 2023
9,Bath & N E Somerset,listing_64696452,£850 pcm,"Leaze House, Frome BA11",1 bed flat to rent,Listed on 23rd May 2023
10,Bath & N E Somerset,listing_64815506,"£1,200 pcm","Bearfield Buildings, Bradford-On-Avon BA15",2 bed terraced house to rent,Listed on 7th Jun 2023
11,Bath & N E Somerset,listing_55267242,"£1,250 pcm","Southfields, Frome BA11",3 bed property to rent,Listed on 12th Jun 2023
12,Bath & N E Somerset,listing_58725539,"£1,350 pcm","Wiltshire Way, Westbury BA13",3 bed property to rent,Listed on 13th Jun 2023
13,Bath & N E Somerset,listing_64861914,"£1,400 pcm","Buttercup Crescent, Emersons Green, Bristol BS16",2 bed property to rent,Listed on 13th Jun 2023
14,Bath & N E Somerset,listing_64728338,"£1,550 pcm","West View, Bristol BS16",3 bed property to rent,Listed on 26th May 2023
15,Bath & N E Somerset,listing_64583184,"£1,570 pcm","Willis Road, Bristol BS15",3 bed property to rent,Listed on 9th May 2023
16,Bath & N E Somerset,listing_64682024,"£1,600 pcm","Westwells, Neston, Corsham SN13",4 bed semi-detached house to rent,Listed on 22nd May 2023
17,Bath & N E Somerset,listing_64869319,"£1,600 pcm","King William Street, Bedminster BS3",2 bed terraced house to rent,Listed on 14th Jun 2023
18,Bath & N E Somerset,listing_64797161,"£1,675 pcm","Alliance House, Bristol BS1",1 bed flat to rent,Listed on 6th Jun 2023
19,Bath & N E Somerset,listing_64826672,"£1,700 pcm","Drynham Lane, North Bradley, Trowbridge BA14",3 bed detached house to rent,Listed on 9th Jun 2023
20,Bath & N E Somerset,listing_64866077,"£1,795 pcm","Coronation Avenue, Fishponds, Bristol BS16",3 bed property to rent,Listed on 13th Jun 2023
21,Bath & N E Somerset,listing_64464194,"£2,400 pcm","Crusader House, Bristol BS1",1 bed flat to rent,Listed on 22nd Apr 2023
22,Bath & N E Somerset,listing_64866784,"£2,500 pcm","Manor Gardens, Bradford-On-Avon BA15",4 bed property to rent,Listed on 14th Jun 2023
23,Bath & N E Somerset,listing_52264635,"£2,700 pcm","Budbury Place, Bradford-On-Avon BA15",4 bed semi-detached house to rent,Listed on 31st May 2023
24,Bath & N E Somerset,listing_62873610,"£3,750 pcm","Elley Green, Corsham SN13",4 bed semi-detached house to rent,Listed on 14th Nov 2022
25,Bedfordshire,listing_64872899,£430 pcm,"Morteyne Road Marston Beds, Beds Mk MK43",1 bed property to rent,Listed on 14th Jun 2023
26,Bedfordshire,listing_64880174,£875 pcm,"St Peters St, Bedford MK40",Studio to rent,Listed on 15th Jun 2023
27,Bedfordshire,listing_64804886,£950 pcm,"Tennyson Road, Luton LU1",1 bed maisonette to rent,Listed on 6th Jun 2023
28,Bedfordshire,listing_64866959,£980 pcm,"High Street, Cranfield MK43",Studio to rent,Listed on 14th Jun 2023
29,Bedfordshire,listing_55029387,"£1,000 pcm","Lurke Street, Bedford MK40",1 bed flat to rent,Listed on 14th Jun 2023
30,Bedfordshire,listing_55571163,"£1,050 pcm","Lurke Street, Bedford MK40",1 bed flat to rent,Listed on 6th Jun 2023
31,Bedfordshire,listing_64880124,"£1,050 pcm","St Peters St, Bedford MK40",1 bed flat to rent,Listed on 15th Jun 2023
32,Bedfordshire,listing_64880067,"£1,065 pcm","St Peters St, Bedford MK40",1 bed flat to rent,Listed on 15th Jun 2023
33,Bedfordshire,listing_64806340,"£1,300 pcm","The Ridings, Luton LU3",2 bed flat to rent,Listed on 7th Jun 2023
34,Bedfordshire,listing_64821712,"£1,399 pcm","Houghton Regis, Dunstable LU5",1 bed flat to rent,Listed on 8th Jun 2023
35,Bedfordshire,listing_64838998,"£1,400 pcm","Littleworth, Wing, Leighton Buzzard LU7",3 bed property to rent,Listed on 10th Jun 2023
36,Bedfordshire,listing_64879897,"£1,400 pcm","St Peters St, Bedford MK40",2 bed flat to rent,Listed on 15th Jun 2023
37,Bedfordshire,listing_64842023,"£1,450 pcm","St. Andrews Close, Slip End, Luton LU1",3 bed semi-detached house to rent,Listed on 12th Jun 2023
38,Bedfordshire,listing_64805455,"£1,500 pcm","High Street, Bedford MK43",3 bed cottage to rent,Listed on 6th Jun 2023
39,Bedfordshire,listing_61313428,"£1,600 pcm","Cleat Hill, Bedford MK41",4 bed detached bungalow to rent,Listed on 2nd Jun 2023
40,Bedfordshire,listing_64840455,"£1,600 pcm","Blackburn Way, Biggleswade SG18",3 bed detached house to rent,Listed on 10th Jun 2023
41,Bedfordshire,listing_64767697,"£1,800 pcm","Ascott Kennels Cottage, Wing, Leighton Buzzard LU7",3 bed detached house to rent,Listed on 1st Jun 2023
42,Bedfordshire,listing_64878489,"£1,850 pcm","Thelby Close, Luton LU3",3 bed detached house to rent,Listed on 15th Jun 2023
43,Bedfordshire,listing_64338363,"£2,070 pcm","Bedford Road, Bedford MK42",1 bed flat to rent,Listed on 5th Apr 2023
44,Bedfordshire,listing_64612412,"£2,300 pcm","Spenser Road, Bedford MK40",5 bed semi-detached house to rent,Listed on 12th May 2023
45,Bedfordshire,listing_64338358,"£2,340 pcm","Bedford Road, Bedford MK42",1 bed flat to rent,Listed on 5th Apr 2023
46,Bedfordshire,listing_44619744,"£2,500 pcm","Wing, Leighton Buzzard LU7",5 bed detached house to rent,Listed on 14th Jun 2023
47,Bedfordshire,listing_64685547,"£3,250 pcm","Busby Mead, Marston Moretaine MK43",7 bed detached house to rent,Listed on 22nd May 2023
48,Berkshire,listing_64018669,£850 pcm,"Wisteria, Old Bath Road, Slough, Berkshire SL3",Studio to rent,Listed on 23rd Feb 2023
49,Berkshire,listing_64018680,£850 pcm,"Old Bath Road, Slough SL3",Studio to rent,Listed on 23rd Feb 2023
50,Berkshire,listing_64018696,£925 pcm,"Old Bath Road, Slough SL3",Studio to rent,Listed on 23rd Feb 2023
51,Berkshire,listing_64836276,£995 pcm,"Ashridge Manor, Forest Road, Wokingham, Berkshire RG40",1 bed property to rent,Listed on 9th Jun 2023
52,Berkshire,listing_64815976,"£1,025 pcm","Grenville Place, Bracknell RG12",1 bed flat to rent,Listed on 7th Jun 2023
53,Berkshire,listing_60074045,"£1,050 pcm","Warnsham Close, Lower Earley RG6",1 bed property to rent,Listed on 14th Jun 2023
54,Berkshire,listing_64694841,"£1,050 pcm","Sorrel Close, Newbury RG14",2 bed flat to rent,Listed on 23rd May 2023
55,Berkshire,listing_64804975,"£1,175 pcm","North Town Road, Maidenhead SL6",1 bed flat to rent,Listed on 6th Jun 2023
56,Berkshire,listing_59973428,"£1,200 pcm","3 Cook Way, Arborfield Green RG2, Arborfield Green,",1 bed flat to rent,Listed on 3rd Oct 2022
57,Berkshire,listing_64677761,"£1,250 pcm","London Road, Newbury RG14",2 bed flat to rent,Listed on 21st May 2023
58,Berkshire,listing_64855783,"£1,250 pcm","Blossom Lane, Theale, Reading RG7",2 bed maisonette to rent,Listed on 12th Jun 2023
59,Berkshire,listing_64488833,"£1,275 pcm","Donnington Square, Newbury RG14",1 bed flat to rent,Listed on 26th Apr 2023
60,Berkshire,listing_58926235,"£1,300 pcm","Mars Close, Woosehill, Wokingham, Berkshire RG41",1 bed end terrace house to rent,Listed on 27th May 2023
61,Berkshire,listing_64805047,"£1,300 pcm","Poperinghe Way, Arborfield, Reading RG2",2 bed end terrace house to rent,Listed on 6th Jun 2023
62,Berkshire,listing_64879768,"£1,300 pcm","Market Street, Bracknell RG12",1 bed flat to rent,Listed on 15th Jun 2023
63,Berkshire,listing_64841628,"£1,345 pcm","Howard Street, Reading RG1",2 bed flat to rent,Listed on 11th Jun 2023
64,Berkshire,listing_46895966,"£1,425 pcm","Queen Street, Maidenhead SL6",Studio to rent,Listed on 7th Jun 2023
65,Berkshire,listing_55033359,"£1,425 pcm","Queen Street, Maidnehead, Berkshire SL6",Studio to rent,Listed on 26th May 2023
66,Berkshire,listing_64738826,"£1,425 pcm","Maidenhead, Berkshire SL6",Studio to rent,Listed on 30th May 2023
67,Berkshire,listing_64852773,"£1,450 pcm","Berkeley Road, Newbury RG14",3 bed end terrace house to rent,Listed on 12th Jun 2023
68,Berkshire,listing_61088838,"£1,500 pcm","3 Cook Way, Arborfield Green RG2",2 bed flat to rent,Listed on 3rd Oct 2022
69,Berkshire,listing_64854837,"£1,500 pcm","Easthampstead Road, Wokingham RG40",2 bed semi-detached house to rent,Listed on 12th Jun 2023
70,Berkshire,listing_64805708,"£1,525 pcm","Addison Road, Reading RG1",3 bed terraced house to rent,Listed on 6th Jun 2023
71,Berkshire,listing_61059204,"£1,550 pcm","Maidenhead, Berkshire SL6",1 bed flat to rent,Listed on 6th Apr 2023
72,Berkshire,listing_61688417,"£1,550 pcm","Jago Court, Newbury RG14",3 bed terraced house to rent,Listed on 16th May 2023
73,Berkshire,listing_64841802,"£1,550 pcm","Hall Court, Datchet, Slough SL3",2 bed flat to rent,Listed on 12th Jun 2023
74,Berkshire,listing_64879844,"£1,590 pcm","Market Street, Bracknell RG12",2 bed flat to rent,Listed on 15th Jun 2023
75,Berkshire,listing_63627145,"£1,595 pcm","Bartholomew Street, Newbury RG14",2 bed flat to rent,Listed on 9th Jan 2023
76,Berkshire,listing_55066450,"£1,600 pcm","Berkshire House, Queen Street, Maidenhead, Berkshire SL6",1 bed flat to rent,Listed on 4th May 2023
77,Berkshire,listing_64626284,"£1,600 pcm","Maidenhead, Berkshire SL6",1 bed flat to rent,Listed on 5th May 2023
78,Berkshire,listing_64705303,"£1,600 pcm","Maidenhead, Berkshire SL6",1 bed flat to rent,Listed on 24th May 2023
79,Berkshire,listing_64817607,"£1,600 pcm","Berkshire House, Maidenhead SL6",1 bed flat to rent,Listed on 7th Jun 2023
80,Berkshire,listing_64128912,"£1,675 pcm","Napier Road, Reading RG1",1 bed flat to rent,Listed on 8th Mar 2023
81,Berkshire,listing_64712063,"£1,675 pcm","Andover Drove, Wash Water, Newbury RG20",3 bed detached house to rent,Listed on 25th May 2023
82,Berkshire,listing_52916899,"£1,700 pcm","School Drive, Woodley RG5",3 bed property to rent,Listed on 14th Jun 2023
83,Berkshire,listing_64818943,"£1,700 pcm","Harwich Close, Lower Earley RG6",3 bed property to rent,Listed on 8th Jun 2023
84,Berkshire,listing_64808155,"£1,750 pcm","Midgham Green, Midgham, Reading RG7",3 bed detached house to rent,Listed on 7th Jun 2023
85,Berkshire,listing_64816216,"£1,800 pcm","London Road, Wokingham RG40",2 bed detached house to rent,Listed on 7th Jun 2023
86,Berkshire,listing_64662517,"£1,850 pcm","Windsor Road, Slough SL1",2 bed flat to rent,Listed on 19th May 2023
87,Berkshire,listing_64707511,"£1,850 pcm","Alder Grove, Shinfield, Reading, Berkshire RG2",3 bed end terrace house to rent,Listed on 24th May 2023
88,Berkshire,listing_64858652,"£1,850 pcm","St Pauls Gate, Wokingham RG41",3 bed semi-detached house to rent,Listed on 13th Jun 2023
89,Berkshire,listing_64447506,"£1,950 pcm","Sussex House, Reading RG1",2 bed flat to rent,Listed on 20th Apr 2023
90,Berkshire,listing_62825445,"£1,995 pcm","Napier Road, Reading RG1",2 bed flat to rent,Listed on 7th Nov 2022
91,Berkshire,listing_64522624,"£2,000 pcm","Autumn Close, Emmer Green, Reading RG4",3 bed bungalow to rent,Listed on 1st May 2023
92,Berkshire,listing_61086648,"£2,095 pcm","Napier Road, Reading RG1",2 bed flat to rent,Listed on 25th Mar 2022
93,Berkshire,listing_63469540,"£2,100 pcm","Napier Road, Reading RG1",2 bed flat to rent,Listed on 15th Dec 2022
94,Berkshire,listing_63795894,"£2,100 pcm","Hythe Close, Bracknell RG12",1 bed property to rent,Listed on 24th Jan 2023
95,Berkshire,listing_64791696,"£2,200 pcm","Cirrus Drive, Shinfield, Reading RG2",4 bed end terrace house to rent,Listed on 5th Jun 2023
96,Berkshire,listing_62052516,"£2,250 pcm","12-18 Crown Street, Reading RG1",1 bed flat to rent,Listed on 27th Jul 2022
97,Berkshire,listing_63890049,"£2,250 pcm","Wiltshire Road, Wokingham RG40",1 bed flat to rent,Listed on 6th Feb 2023
98,Berkshire,listing_64309542,"£2,250 pcm","City Road, Tilehurst, Reading RG31",4 bed detached bungalow to rent,Listed on 31st Mar 2023
99,Berkshire,listing_64813399,"£2,250 pcm","Uxmore Road, Checkendon, Reading, Oxfordshire RG8",3 bed detached house to rent,Listed on 7th Jun 2023
100,Berkshire,listing_64854973,"£2,300 pcm","Queen's Road, Reading RG1",2 bed flat to rent,Listed on 12th Jun 2023
101,Berkshire,listing_64736383,"£2,350 pcm","Bramley Close, Maidenhead SL6",4 bed semi-detached house to rent,Listed on 29th May 2023
102,Berkshire,listing_64569754,"£2,400 pcm","Southampton Street, Reading RG1",2 bed flat to rent,Listed on 7th May 2023
103,Berkshire,listing_45410520,"£2,500 pcm","Fernbank, Finchampstead, Wokingham RG40",4 bed detached house to rent,Listed on 9th Jun 2023
104,Berkshire,listing_55585221,"£2,500 pcm","London Road, Wokingham RG40",4 bed detached house to rent,Listed on 23rd May 2023
105,Berkshire,listing_64345880,"£2,500 pcm","Chavey Down, Ascot SL5",4 bed link detached house to rent,Listed on 5th Apr 2023
106,Berkshire,listing_64749874,"£2,500 pcm","Trevelyan, Bracknell RG12",4 bed detached house to rent,Listed on 31st May 2023
107,Berkshire,listing_61758786,"£2,550 pcm","Farnham Road, Slogh SL1",1 bed flat to rent,Listed on 21st Jun 2022
108,Berkshire,listing_62651057,"£2,600 pcm","Charters Lane, Ascot SL5",2 bed flat to rent,Listed on 2nd Nov 2022
109,Berkshire,listing_64563264,"£2,600 pcm","Ruby Close, Wokingham RG41",4 bed semi-detached house to rent,Listed on 5th May 2023
110,Berkshire,listing_64598774,"£2,600 pcm","Ruby Close, Wokingham RG41",4 bed semi-detached house to rent,Listed on 11th May 2023
111,Berkshire,listing_64840381,"£2,600 pcm","Beech Hill Road, Sunningdale, Ascot SL5",4 bed detached house to rent,Listed on 10th Jun 2023
112,Berkshire,listing_62052343,"£2,700 pcm","4 Oxford Street, Newbury RG14",1 bed flat to rent,Listed on 27th Jul 2022
113,Berkshire,listing_62052524,"£2,700 pcm","12-18 Crown Street, Reading RG1",1 bed flat to rent,Listed on 27th Jul 2022
114,Berkshire,listing_64767428,"£2,700 pcm","Orchard Close, Wokingham RG40",2 bed property to rent,Listed on 1st Jun 2023
115,Berkshire,listing_64697647,"£2,750 pcm","The Limes, Hayley Green, Bracknell RG42",4 bed property to rent,Listed on 23rd May 2023
116,Berkshire,listing_64761450,"£2,750 pcm","Leicester, Bracknell RG12",2 bed property to rent,Listed on 1st Jun 2023
117,Berkshire,listing_64828022,"£2,750 pcm","St. Peters Avenue, Caversham, Reading RG4",4 bed detached house to rent,Listed on 9th Jun 2023
118,Berkshire,listing_64878130,"£2,750 pcm","Victoria Road, Ascot SL5",3 bed semi-detached house to rent,Listed on 15th Jun 2023
119,Berkshire,listing_43634270,"£3,000 pcm","Woodlands Ride, South Ascot SL5",5 bed detached house to rent,Listed on 18th Jan 2023
120,Berkshire,listing_64732699,"£3,000 pcm","Oatlands Road, Shinfield, Reading RG2",4 bed detached house to rent,Listed on 27th May 2023
121,Berkshire,listing_64658605,"£3,100 pcm","Flycatcher Keep, Bracknell RG12",2 bed property to rent,Listed on 18th May 2023
122,Berkshire,listing_62058823,"£3,150 pcm","219 Bath Road, Slough SL1",1 bed flat to rent,Listed on 28th Jul 2022
123,Berkshire,listing_64710282,"£3,200 pcm","Coleridge Close, Twyford, Reading RG10",2 bed property to rent,Listed on 25th May 2023
124,Berkshire,listing_64710320,"£3,200 pcm","Bridle Road, Whitchurch Hill, Reading, Oxfordshire RG8",4 bed detached house to rent,Listed on 25th May 2023
125,Berkshire,listing_62787585,"£3,215 pcm","Premier Suites, Minster Court, Reading, Berkshire RG1",1 bed flat to rent,Listed on 2nd Nov 2022
126,Berkshire,listing_62052351,"£3,450 pcm","4 Oxford Street, Newbury RG14",2 bed flat to rent,Listed on 27th Jul 2022
127,Berkshire,listing_64254245,"£3,500 pcm","Chavey Down Road, Winkfield Row RG42",5 bed detached bungalow to rent,Listed on 24th Mar 2023
128,Berkshire,listing_64691220,"£3,500 pcm","Hatchet Lane, Windsor SL4",1 bed detached house to rent,Listed on 23rd May 2023
129,Berkshire,listing_64857712,"£3,500 pcm","Hatchet Lane, Winkfield, Windsor, Berkshire SL4",4 bed detached house to rent,Listed on 13th Jun 2023
130,Berkshire,listing_62052601,"£3,600 pcm","12-18 Crown Street, Reading RG1",2 bed flat to rent,Listed on 27th Jul 2022
131,Berkshire,listing_62058852,"£3,600 pcm","219 Bath Road, Slough SL1",2 bed flat to rent,Listed on 28th Jul 2022
132,Berkshire,listing_64174333,"£3,700 pcm","Alexandra Road, Windsor SL4",3 bed terraced house to rent,Listed on 14th Mar 2023
133,Berkshire,listing_64647009,"£3,700 pcm","Vansittart Road, Windsor SL4",2 bed property to rent,Listed on 17th May 2023
134,Berkshire,listing_64854802,"£3,700 pcm","Alexandra Road, Windsor SL4",3 bed terraced house to rent,Listed on 12th Jun 2023
135,Berkshire,listing_64474628,"£3,750 pcm","Clewer Fields, Windsor SL4",2 bed semi-detached house to rent,Listed on 24th Apr 2023
136,Berkshire,listing_64725957,"£3,850 pcm","Shrubbs Hill Lane, Ascot SL5",3 bed semi-detached house to rent,Listed on 26th May 2023
137,Berkshire,listing_62787562,"£3,943 pcm","Premier Suite, Minster Court, Reading, Berkshire RG1",2 bed flat to rent,Listed on 2nd Nov 2022
138,Berkshire,listing_64470706,"£4,000 pcm","Station Road, Sunningdale, Ascot SL5",3 bed end terrace house to rent,Listed on 24th Apr 2023
139,Berkshire,listing_64761374,"£4,000 pcm","Watersplash Lane, Warfield, Bracknell, Berkshire RG42",5 bed detached house to rent,Listed on 1st Jun 2023
140,Berkshire,listing_61345277,"£4,095 pcm","Beaumont Cottages, Windsor SL4",3 bed semi-detached house to rent,Listed on 28th Apr 2022
141,Berkshire,listing_64824325,"£4,250 pcm","Cardwell Crescent, Ascot SL5",2 bed flat to rent,Listed on 8th Jun 2023
142,Berkshire,listing_64776494,"£4,280 pcm","Wellingtonia Drive, Crookham Common, Thatcham RG19",4 bed detached house to rent,Listed on 2nd Jun 2023
143,Berkshire,listing_64212213,"£4,500 pcm","Pinkneys Drive, Maidenhead SL6",2 bed terraced house to rent,Listed on 20th Mar 2023
144,Berkshire,listing_64519758,"£4,750 pcm","Coalmans Way, Burnham SL1",4 bed detached house to rent,Listed on 29th Apr 2023
145,Berkshire,listing_63838396,"£4,800 pcm","Leander Way, Maidenhead SL6",3 bed property to rent,Listed on 30th Jan 2023
146,Berkshire,listing_64785052,"£4,950 pcm","Westridge, Highclere RG20",5 bed detached house to rent,Listed on 5th Jun 2023
147,Berkshire,listing_63371301,"£5,000 pcm","Innings Lane, White Waltham, Maidenhead, Berkshire SL6.",6 bed detached house to rent,Listed on 19th May 2023
148,Berkshire,listing_64735958,"£5,000 pcm","St. Marks Crescent, Maidenhead SL6",4 bed property to rent,Listed on 29th May 2023
149,Berkshire,listing_61843882,"£5,750 pcm","Charters Way, Sunningdale SL5",3 bed semi-detached house to rent,Listed on 30th Jun 2022
150,Berkshire,listing_64824195,"£7,950 pcm","London Road, Sunningdale, Berkshire SL5",4 bed semi-detached house to rent,Listed on 8th Jun 2023
151,Berkshire,listing_60867287,"£8,333 pcm","Forest Road, Warfield, Bracknell RG42",4 bed detached house to rent,Listed on 28th Feb 2022
152,Berkshire,listing_64832104,"£10,000 pcm","White Heath, The Asters, Devenish Road, Sunningdale, Ascot, Berkshire SL5",6 bed detached house to rent,Listed on 9th Jun 2023
153,Berkshire,listing_64258285,"£20,000 pcm","Church Lane, Grazeley, Reading, Berkshire RG7",8 bed detached house to rent,Listed on 24th Mar 2023
154,Berkshire,listing_64586832,"£20,000 pcm","Winkfield Lane, Winkfield SL4",7 bed detached house to rent,Listed on 10th May 2023
155,Bristol,listing_64784825,£725 pcm,"Callington Road, Bristol BS4",1 bed property to rent,Listed on 4th Jun 2023
156,Bristol,listing_64709478,£945 pcm,"Key Worker Accommodation, Honeysuckle Walk, Southmead, Bristol BS10",1 bed flat to rent,Listed on 25th May 2023
157,Bristol,listing_64709698,£945 pcm,"Key Worker Accommodation, Honeysuckle Walk, Southmead, Bristol BS10",1 bed flat to rent,Listed on 25th May 2023
158,Bristol,listing_64735106,£950 pcm,"Redland, Bristol BS6",Studio to rent,Listed on 29th May 2023
159,Bristol,listing_64876156,"£1,250 pcm","Little Stoke, Bristol BS34",2 bed semi-detached bungalow to rent,Listed on 14th Jun 2023
160,Bristol,listing_64546911,"£1,350 pcm","Honeysuckle Walk, Southmead, Bristol BS10",2 bed flat to rent,Listed on 4th May 2023
161,Bristol,listing_64861914,"£1,400 pcm","Buttercup Crescent, Emersons Green, Bristol BS16",2 bed property to rent,Listed on 13th Jun 2023
162,Bristol,listing_64862822,"£1,400 pcm","Sunningdale, Bristol BS8",Studio to rent,Listed on 13th Jun 2023
163,Bristol,listing_64615626,"£1,450 pcm","Elm Close, Little Stoke, South Gloucestershire BS34",3 bed property to rent,Listed on 12th May 2023
164,Bristol,listing_64657277,"£1,500 pcm","High Street, Shirehampton, Bristol BS11",3 bed maisonette to rent,Listed on 18th May 2023
165,Bristol,listing_64866356,"£1,500 pcm","Cotham Brow, Bristol BS6",2 bed flat to rent,Listed on 14th Jun 2023
166,Bristol,listing_64728338,"£1,550 pcm","West View, Bristol BS16",3 bed property to rent,Listed on 26th May 2023
167,Bristol,listing_64583184,"£1,570 pcm","Willis Road, Bristol BS15",3 bed property to rent,Listed on 9th May 2023
168,Bristol,listing_64869319,"£1,600 pcm","King William Street, Bedminster BS3",2 bed terraced house to rent,Listed on 14th Jun 2023
169,Bristol,listing_64797161,"£1,675 pcm","Alliance House, Bristol BS1",1 bed flat to rent,Listed on 6th Jun 2023
170,Bristol,listing_64866077,"£1,795 pcm","Coronation Avenue, Fishponds, Bristol BS16",3 bed property to rent,Listed on 13th Jun 2023
171,Bristol,listing_64717903,"£1,800 pcm","Rushy Way, Emersons Green, Bristol BS16",4 bed property to rent,Listed on 25th May 2023
172,Bristol,listing_64793929,"£1,800 pcm","Gordon Road, Clifton, Bristol BS8",2 bed flat to rent,Listed on 5th Jun 2023
173,Bristol,listing_64837707,"£1,800 pcm","Rushy Way, Emersons Green, Bristol BS16",4 bed property to rent,Listed on 10th Jun 2023
174,Bristol,listing_64821898,"£1,900 pcm","Stroud Road, Patchway, Bristol BS34",4 bed terraced house to rent,Listed on 8th Jun 2023
175,Bristol,listing_64800666,"£1,995 pcm","Beach Road, Severn Beach, Bristol BS35",4 bed detached house to rent,Listed on 6th Jun 2023
176,Bristol,listing_64798038,"£2,000 pcm","Brangwyn Grove, Bristol BS7",3 bed terraced house to rent,Listed on 6th Jun 2023
177,Bristol,listing_64831939,"£2,000 pcm","Lowlis Close, Bristol BS10",3 bed semi-detached house to rent,Listed on 9th Jun 2023
178,Bristol,listing_64841869,"£2,100 pcm","Ravenglass Crescent, Bristol BS10",4 bed semi-detached house to rent,Listed on 12th Jun 2023
179,Bristol,listing_42237110,"£2,200 pcm","Richmond Terrace, Clifton, Bristol BS8",3 bed flat to rent,Listed on 14th Jun 2023
180,Bristol,listing_64464194,"£2,400 pcm","Crusader House, Bristol BS1",1 bed flat to rent,Listed on 22nd Apr 2023
181,Bristol,listing_59613092,"£2,500 pcm","Burden Close, Bradley Stoke, Bristol BS32",2 bed property to rent,Listed on 29th Sep 2022
182,Bristol,listing_59613105,"£2,750 pcm","Great George Street, Bristol BS1",2 bed flat to rent,Listed on 17th Mar 2023
183,Bristol,listing_63895830,"£4,250 pcm","Rockleaze Road, Bristol BS9",3 bed property to rent,Listed on 7th Feb 2023
184,Bristol,listing_64729478,"£4,500 pcm","Rockleaze Road, Bristol BS9",3 bed property to rent,Listed on 27th May 2023
185,Buckinghamshire,listing_40138151,£925 pcm,"Main Street, Twyford, Buckingham MK18",2 bed cottage to rent,Listed on 8th Feb 2023
186,Buckinghamshire,listing_62134616,£950 pcm,"Reynold Drive, Aylesbury HP20",1 bed maisonette to rent,Listed on 2nd May 2023
187,Buckinghamshire,listing_64635184,"£1,000 pcm","Abercromby Avenue, High Wycombe HP12",1 bed flat to rent,Listed on 16th May 2023
188,Buckinghamshire,listing_64857334,"£1,000 pcm","Belgrave Road, Aylesbury HP19",1 bed maisonette to rent,Listed on 13th Jun 2023
189,Buckinghamshire,listing_64881120,"£1,100 pcm","Artizan Road, Northampton NN1",2 bed flat to rent,Listed on 15th Jun 2023
190,Buckinghamshire,listing_64621053,"£1,120 pcm","Silbury Boulevard, Milton Keynes MK9",1 bed flat to rent,Listed on 14th May 2023
191,Buckinghamshire,listing_64677897,"£1,150 pcm","London Road, Chalfont St. Giles HP8",1 bed flat to rent,Listed on 21st May 2023
192,Buckinghamshire,listing_64846661,"£1,150 pcm","Bullocks Farm Lane, Wheeler End, High Wycombe HP14",1 bed property to rent,Listed on 12th Jun 2023
193,Buckinghamshire,listing_26966962,"£1,200 pcm","Sandhill Way, Aylesbury, Buckinghamshire HP19",2 bed terraced house to rent,Listed on 8th Jun 2023
194,Buckinghamshire,listing_64682435,"£1,300 pcm","Blind Lane, Bourne End SL8",2 bed flat to rent,Listed on 22nd May 2023
195,Buckinghamshire,listing_64816649,"£1,300 pcm","Chapel Street, Woburn Sands, Milton Keynes MK17",2 bed end terrace house to rent,Listed on 8th Jun 2023
196,Buckinghamshire,listing_58986060,"£1,350 pcm","Jonathans, Coffee Hall, Milton Keynes MK6",3 bed bungalow to rent,Listed on 13th Jun 2023
197,Buckinghamshire,listing_64717227,"£1,350 pcm","Bramble Avenue, Conniburrow, Milton Keynes MK14",4 bed terraced house to rent,Listed on 25th May 2023
198,Buckinghamshire,listing_64791678,"£1,350 pcm","Tickford Street, Newport Pagnell MK16",3 bed terraced house to rent,Listed on 5th Jun 2023
