,County,Property ID,Price per month,Address,Property Description,Date of Listing
1956,Suffolk,listing_64187200,"£2,200 pcm","Church Road, Brandon IP27",4 bed property to rent,Listed on 15th Mar 2023
1957,Suffolk,listing_64569718,"£2,200 pcm","Church Road, Brandon, Suffolk. IP27",4 bed detached house to rent,Listed on 7th May 2023
1958,Suffolk,listing_64701983,"£2,200 pcm","Angel Hill, Bury St Edmunds IP33",4 bed property to rent,Listed on 24th May 2023
1959,Suffolk,listing_52748678,"£2,400 pcm","Bernards Close, Bury St. Edmunds IP28",5 bed detached house to rent,Listed on 8th Jun 2023
1960,Suffolk,listing_64823949,"£2,700 pcm","High Baxter Street, Bury St Edmunds IP33",4 bed property to rent,Listed on 8th Jun 2023
1961,Suffolk,listing_63762732,"£2,900 pcm","Stanstead Road, Shimpling IP29",6 bed detached house to rent,Listed on 19th Jan 2023
1962,Surrey,listing_64872797,£845 pcm,"Pond Road, Egham TW20",Studio to rent,Listed on 14th Jun 2023
1963,Surrey,listing_64650997,£900 pcm,"Plaistow Road, Godalming GU8",2 bed mobile/park home to rent,Listed on 17th May 2023
1964,Surrey,listing_64854845,"£1,075 pcm","Raglan Road, Knaphill GU21",1 bed flat to rent,Listed on 12th Jun 2023
1965,Surrey,listing_64757597,"£1,150 pcm","Chaldon Road, Caterham CR3",1 bed flat to rent,Listed on 31st May 2023
1966,Surrey,listing_64647124,"£1,250 pcm","101 London Road, Surrey RH1",1 bed block of flats to rent,Listed on 17th May 2023
1967,Surrey,listing_64765901,"£1,250 pcm","Geneva Close, Shepperton TW17",1 bed end terrace house to rent,Listed on 1st Jun 2023
1968,Surrey,listing_64878580,"£1,295 pcm","Church Road, Epsom KT17",1 bed maisonette to rent,Listed on 15th Jun 2023
1969,Surrey,listing_64715922,"£1,345 pcm","Brightwells Yard, 12 Old Market Place, Farnham GU9",1 bed flat to rent,Listed on 25th May 2023
1970,Surrey,listing_64603050,"£1,365 pcm","Brightwells Yard, Old Market Place, Farnham GU9",1 bed flat to rent,Listed on 11th May 2023
1971,Surrey,listing_64587669,"£1,400 pcm","Clyde Road, Croydon CR0",2 bed flat to rent,Listed on 10th May 2023
1972,Surrey,listing_63566092,"£1,450 pcm","Church Street, Dorking RH4",2 bed terraced house to rent,Listed on 7th Jun 2023
1973,Surrey,listing_61094723,"£1,500 pcm","Foxley Close, Blackwater, Camberley GU17",3 bed semi-detached house to rent,Listed on 9th May 2023
1974,Surrey,listing_64876031,"£1,550 pcm","Martineau Drive, Dorking RH4",3 bed bungalow to rent,Listed on 14th Jun 2023
1975,Surrey,listing_52421600,"£1,600 pcm","Tower Road, Hindhead GU26",2 bed flat to rent,Listed on 14th Jun 2023
1976,Surrey,listing_64646806,"£1,600 pcm","Manning Gardens, Croydon CR0",2 bed flat to rent,Listed on 17th May 2023
1977,Surrey,listing_64838199,"£1,600 pcm","Corner Farm Close, Tadworth KT20",2 bed flat to rent,Listed on 10th Jun 2023
1978,Surrey,listing_64854880,"£1,600 pcm","Rowan House, Guildford GU1",2 bed flat to rent,Listed on 12th Jun 2023
1979,Surrey,listing_64854885,"£1,600 pcm","Frogmore Park Drive, Blackwater, Camberley GU17",3 bed terraced house to rent,Listed on 12th Jun 2023
1980,Surrey,listing_64872902,"£1,600 pcm","Lioncourt, Woking GU22",1 bed maisonette to rent,Listed on 14th Jun 2023
1981,Surrey,listing_64867502,"£1,644 pcm","George Street, Croydon CR0",1 bed flat to rent,Listed on 14th Jun 2023
1982,Surrey,listing_64873860,"£1,650 pcm","Ten Degrees, George Street, Croydon, London CR0",1 bed flat to rent,Listed on 14th Jun 2023
1983,Surrey,listing_64816474,"£1,687 pcm","George Street, Croydon CR0",1 bed flat to rent,Listed on 8th Jun 2023
1984,Surrey,listing_64809145,"£1,693 pcm","Ten Degrees, George Street, Croydon CR0",1 bed flat to rent,Listed on 7th Jun 2023
1985,Surrey,listing_60024120,"£1,700 pcm","Green Street, Sunbury On Thames TW16",3 bed maisonette to rent,Listed on 30th May 2023
1986,Surrey,listing_64877533,"£1,700 pcm","George Street, Croydon CR0",1 bed flat to rent,Listed on 15th Jun 2023
1987,Surrey,listing_64877539,"£1,700 pcm","George Street, Croydon CR0",1 bed flat to rent,Listed on 15th Jun 2023
1988,Surrey,listing_64429956,"£1,706 pcm","George Street, Croydon CR0",1 bed flat to rent,Listed on 18th Apr 2023
1989,Surrey,listing_64662264,"£1,725 pcm","Ten Degrees, Croydon CR0",1 bed flat to rent,Listed on 19th May 2023
1990,Surrey,listing_64815573,"£1,750 pcm","Roman Farm Road, Guildford GU2",4 bed terraced house to rent,Listed on 7th Jun 2023
1991,Surrey,listing_64879633,"£1,750 pcm","Tower Court, Tower Road, Tadworth KT20",3 bed maisonette to rent,Listed on 15th Jun 2023
1992,Surrey,listing_64878970,"£1,769 pcm","George Street, Croydon CR0",1 bed flat to rent,Listed on 15th Jun 2023
1993,Surrey,listing_64862338,"£1,775 pcm","Ten Degrees, George Street, Croydon CR0",1 bed flat to rent,Listed on 13th Jun 2023
1994,Surrey,listing_64872632,"£1,789 pcm","Ten Degrees, George Street, Croydon CR0",1 bed flat to rent,Listed on 14th Jun 2023
1995,Surrey,listing_64573134,"£1,800 pcm","Tugela Road, Croydon CR0",2 bed end terrace house to rent,Listed on 8th May 2023
1996,Surrey,listing_64416523,"£1,820 pcm","Ten Degrees, Croydon CR0",1 bed flat to rent,Listed on 17th Apr 2023
1997,Surrey,listing_64841616,"£1,850 pcm","Shakespeare Terrace, Richmond TW9",1 bed flat to rent,Listed on 11th Jun 2023
1998,Surrey,listing_64416510,"£1,875 pcm","Ten Degrees, Croydon CR0",1 bed flat to rent,Listed on 17th Apr 2023
1999,Surrey,listing_63961615,"£1,885 pcm","Ten Degrees, George Street, Croydon CR0",1 bed flat to rent,Listed on 15th Feb 2023
2000,Surrey,listing_63850083,"£1,900 pcm","Roundhill Way, Guildford GU2",4 bed semi-detached house to rent,Listed on 31st Jan 2023
2001,Surrey,listing_64637644,"£1,965 pcm","Brightwells Yard, Old Market Place, Farnham GU9",2 bed flat to rent,Listed on 16th May 2023
2002,Surrey,listing_64684362,"£2,000 pcm","Brightwells Yard, Old Market Place, Farnham GU9",2 bed flat to rent,Listed on 22nd May 2023
2003,Surrey,listing_64815508,"£2,000 pcm","Whitehorse Road, Croydon CR0",3 bed semi-detached house to rent,Listed on 7th Jun 2023
2004,Surrey,listing_58016332,"£2,100 pcm","Walnut Tree Close, Guildford GU1",4 bed semi-detached house to rent,Listed on 9th Jun 2023
2005,Surrey,listing_64178128,"£2,100 pcm","Alton Road, Croydon CR0",3 bed semi-detached house to rent,Listed on 15th Mar 2023
2006,Surrey,listing_64858651,"£2,100 pcm","Littleworth Road, Esher KT10",1 bed flat to rent,Listed on 13th Jun 2023
2007,Surrey,listing_64662263,"£2,173 pcm","Ten Degrees, Croydon CR0",2 bed flat to rent,Listed on 19th May 2023
2008,Surrey,listing_64808088,"£2,173 pcm","George Street, Croydon CR0",2 bed flat to rent,Listed on 7th Jun 2023
2009,Surrey,listing_64809221,"£2,173 pcm","Ten Degrees, George Street, Croydon CR0",2 bed flat to rent,Listed on 7th Jun 2023
2010,Surrey,listing_64827635,"£2,173 pcm","George Street, Croydon CR0",2 bed flat to rent,Listed on 9th Jun 2023
2011,Surrey,listing_64842120,"£2,173 pcm","George Street, Croydon CR0",2 bed flat to rent,Listed on 12th Jun 2023
2012,Surrey,listing_64864582,"£2,173 pcm","Ten Degrees, George Street, Croydon, London CR0",2 bed flat to rent,Listed on 13th Jun 2023
2013,Surrey,listing_64867503,"£2,173 pcm","George Street, Croydon CR0",2 bed flat to rent,Listed on 14th Jun 2023
2014,Surrey,listing_63992034,"£2,200 pcm","The Orchard, Lightwater GU18",1 bed property to rent,Listed on 20th Feb 2023
2015,Surrey,listing_64796189,"£2,200 pcm","Addlestone Moor, Addlestone KT15",3 bed detached house to rent,Listed on 6th Jun 2023
2016,Surrey,listing_64862344,"£2,230 pcm","Ten Degrees, George Street, Croydon CR0",2 bed flat to rent,Listed on 13th Jun 2023
2017,Surrey,listing_64521177,"£2,250 pcm","Stuart Road, Richmond TW10",3 bed flat to rent,Listed on 30th Apr 2023
2018,Surrey,listing_64878972,"£2,250 pcm","George Street, Croydon CR0",2 bed flat to rent,Listed on 15th Jun 2023
2019,Surrey,listing_64816473,"£2,274 pcm","Ten Degrees, Croydon CR0",2 bed flat to rent,Listed on 8th Jun 2023
2020,Surrey,listing_64686996,"£2,300 pcm","Violet Lane, Croydon CR0",3 bed terraced house to rent,Listed on 22nd May 2023
2021,Surrey,listing_64857438,"£2,300 pcm","Grantley Road, Guildford GU2",3 bed detached house to rent,Listed on 13th Jun 2023
2022,Surrey,listing_64877542,"£2,300 pcm","George Street, Croydon CR0",2 bed flat to rent,Listed on 15th Jun 2023
2023,Surrey,listing_64877552,"£2,300 pcm","George Street, Croydon CR0",2 bed flat to rent,Listed on 15th Jun 2023
2024,Surrey,listing_64872640,"£2,313 pcm","Ten Degrees, George Street, Croydon CR0",2 bed flat to rent,Listed on 14th Jun 2023
2025,Surrey,listing_64797117,"£2,350 pcm","Kingfisher Court, East Molesey KT8",3 bed flat to rent,Listed on 6th Jun 2023
2026,Surrey,listing_63796163,"£2,356 pcm","Ten Degrees, George Street, Croydon CR0",2 bed flat to rent,Listed on 24th Jan 2023
2027,Surrey,listing_64329205,"£2,425 pcm","Germander Drive, Bisley, Woking GU24",2 bed property to rent,Listed on 4th Apr 2023
2028,Surrey,listing_64693758,"£2,450 pcm","Guildford Road, Normandy, Guildford GU3",3 bed semi-detached house to rent,Listed on 23rd May 2023
2029,Surrey,listing_64784245,"£2,475 pcm","Green Fielde End, Staines Upon Thames TW18",4 bed semi-detached house to rent,Listed on 4th Jun 2023
2030,Surrey,listing_64685562,"£2,495 pcm","Arethusa Way, Bisley, Woking GU24",4 bed detached house to rent,Listed on 22nd May 2023
2031,Surrey,listing_63377265,"£2,499 pcm","Pawsons Road, Croydon, Surrey CR0",5 bed semi-detached house to rent,Listed on 5th Jun 2023
2032,Surrey,listing_64132649,"£2,500 pcm","Shepherds Hill, Guildford, Surrey GU2",5 bed terraced house to rent,Listed on 8th Mar 2023
2033,Surrey,listing_64805286,"£2,500 pcm","Gomer Road, Bagshot GU19",4 bed town house to rent,Listed on 6th Jun 2023
2034,Surrey,listing_64416511,"£2,520 pcm","Ten Dengrees, Croydon CR0",2 bed flat to rent,Listed on 17th Apr 2023
2035,Surrey,listing_64818220,"£2,560 pcm","Croydon, London CR0",1 bed flat to rent,Listed on 8th Jun 2023
2036,Surrey,listing_64676594,"£2,600 pcm","Manor Lane, Sunbury-On-Thames TW16",3 bed terraced house to rent,Listed on 20th May 2023
2037,Surrey,listing_64790436,"£2,600 pcm","The Drive, Ashford TW15",4 bed detached bungalow to rent,Listed on 5th Jun 2023
2038,Surrey,listing_64818225,"£2,610 pcm","Croydon, London CR0",1 bed flat to rent,Listed on 8th Jun 2023
2039,Surrey,listing_64851104,"£2,610 pcm","Croydon, London CR0",1 bed flat to rent,Listed on 12th Jun 2023
2040,Surrey,listing_64834915,"£2,658 pcm","Northfield, Surrey GU18",4 bed detached house to rent,Listed on 9th Jun 2023
2041,Surrey,listing_63751670,"£2,680 pcm","Croydon, London CR0",1 bed flat to rent,Listed on 18th Jan 2023
2042,Surrey,listing_64184214,"£2,700 pcm","Brushfield Way, Knaphill, Woking GU21",2 bed property to rent,Listed on 15th Mar 2023
2043,Surrey,listing_64750369,"£2,700 pcm","Oxford Terrace, Guildford, Surrey GU1",3 bed semi-detached house to rent,Listed on 31st May 2023
2044,Surrey,listing_64815523,"£2,700 pcm","Heathfield Road, Croydon CR0",3 bed flat to rent,Listed on 7th Jun 2023
2045,Surrey,listing_64862830,"£2,700 pcm","Bletchingley Road, Godstone RH9",4 bed semi-detached house to rent,Listed on 13th Jun 2023
2046,Surrey,listing_64304239,"£2,710 pcm","Croydon, London CR0",1 bed flat to rent,Listed on 31st Mar 2023
2047,Surrey,listing_64877065,"£2,750 pcm","The Glade, Croydon CR0",4 bed detached house to rent,Listed on 15th Jun 2023
2048,Surrey,listing_64878525,"£2,760 pcm","Croydon, London CR0",1 bed flat to rent,Listed on 15th Jun 2023
2049,Surrey,listing_64675400,"£2,767 pcm","Goulburn Gardens, Betchworth RH3",3 bed detached house to rent,Listed on 20th May 2023
2050,Surrey,listing_64867504,"£2,774 pcm","George Street, Croydon CR0",3 bed flat to rent,Listed on 14th Jun 2023
2051,Surrey,listing_64873975,"£2,800 pcm","Ten Degrees, George Street, Croydon, London CR0",3 bed flat to rent,Listed on 14th Jun 2023
2052,Surrey,listing_64877555,"£2,800 pcm","George Street, Croydon CR0",3 bed flat to rent,Listed on 15th Jun 2023
2053,Surrey,listing_64782148,"£2,850 pcm","The Sanctuary, Hollesley Farm, Horley, Surrey RH6",4 bed bungalow to rent,Listed on 3rd Jun 2023
2054,Surrey,listing_64493272,"£2,855 pcm","George Street, Croydon CR0",3 bed flat to rent,Listed on 26th Apr 2023
2055,Surrey,listing_64662265,"£2,855 pcm","Ten Degrees, Croydon CR0",3 bed flat to rent,Listed on 19th May 2023
2056,Surrey,listing_64815188,"£2,855 pcm","Ten Degrees, Croydon CR0",3 bed flat to rent,Listed on 7th Jun 2023
2057,Surrey,listing_64809276,"£2,856 pcm","Ten Degrees, George Street, Croydon CR0",3 bed flat to rent,Listed on 7th Jun 2023
2058,Surrey,listing_64858172,"£2,890 pcm","Croydon, London CR0",1 bed flat to rent,Listed on 13th Jun 2023
2059,Surrey,listing_64804255,"£2,895 pcm","Chilmans Drive, Bookham, Leatherhead KT23",4 bed detached house to rent,Listed on 6th Jun 2023
2060,Surrey,listing_64862342,"£2,904 pcm","Ten Degrees, George Street, Croydon CR0",3 bed flat to rent,Listed on 13th Jun 2023
2061,Surrey,listing_63796100,"£2,950 pcm","Strathcona Gardens, Knaphill, Woking GU21",2 bed property to rent,Listed on 24th Jan 2023
2062,Surrey,listing_64789726,"£2,990 pcm","George Street, Croydon CR0",3 bed flat to rent,Listed on 5th Jun 2023
2063,Surrey,listing_64842402,"£2,990 pcm","George Street, Croydon CR0",3 bed flat to rent,Listed on 12th Jun 2023
2064,Surrey,listing_64872643,"£2,990 pcm","Ten Degrees, George Street, Croydon CR0",3 bed flat to rent,Listed on 14th Jun 2023
2065,Surrey,listing_64556487,"£3,000 pcm","Riverview Gardens, Cobham, Surrey KT11",4 bed semi-detached house to rent,Listed on 5th May 2023
2066,Surrey,listing_64658985,"£3,000 pcm","Inkerman Road, Knaphill, Woking GU21",2 bed property to rent,Listed on 18th May 2023
2067,Surrey,listing_64665720,"£3,090 pcm","George Street, Croydon CR0",3 bed flat to rent,Listed on 19th May 2023
2068,Surrey,listing_64878973,"£3,090 pcm","George Street, Croydon CR0",3 bed flat to rent,Listed on 15th Jun 2023
2069,Surrey,listing_64327955,"£3,200 pcm","Field End, Farnham GU9",2 bed property to rent,Listed on 4th Apr 2023
2070,Surrey,listing_64770070,"£3,200 pcm","Lorne Gardens, Knaphill, Woking GU21",2 bed property to rent,Listed on 2nd Jun 2023
2071,Surrey,listing_64804768,"£3,200 pcm","Sunmead Road, Sunbury-On-Thames TW16",5 bed detached house to rent,Listed on 6th Jun 2023
2072,Surrey,listing_64868405,"£3,240 pcm","Croydon, London CR0",2 bed flat to rent,Listed on 14th Jun 2023
2073,Surrey,listing_64773725,"£3,250 pcm","Priors Lane, Blackwater, Camberley GU17",4 bed detached house to rent,Listed on 2nd Jun 2023
2074,Surrey,listing_64866637,"£3,250 pcm","Queens Drive Queens Terrace, Thames Ditton KT7",3 bed end terrace house to rent,Listed on 14th Jun 2023
2075,Surrey,listing_63781783,"£3,275 pcm","Raymond Crescent, Guildford GU2",6 bed semi-detached house to rent,Listed on 22nd Jan 2023
2076,Surrey,listing_64733922,"£3,499 pcm","Ladygrove Drive, Guildford GU4",2 bed end terrace house to rent,Listed on 28th May 2023
2077,Surrey,listing_59211079,"£3,500 pcm","Pine Avenue, Camberley GU15",5 bed detached house to rent,Listed on 6th Jun 2023
2078,Surrey,listing_63917991,"£3,500 pcm","Oatlands Chase, Weybridge, Surrey KT13",3 bed flat to rent,Listed on 9th Feb 2023
2079,Surrey,listing_64121463,"£3,500 pcm","Ash Close, Banstead SM7",5 bed detached house to rent,Listed on 7th Mar 2023
2080,Surrey,listing_64483709,"£3,500 pcm","Kingston Road, Epsom KT19",5 bed property to rent,Listed on 25th Apr 2023
2081,Surrey,listing_64318280,"£3,800 pcm","Manor Lane, Sunbury On Thames TW16",5 bed detached house to rent,Listed on 3rd Apr 2023
2082,Surrey,listing_64862853,"£3,950 pcm","Sheen Park, Richmond TW9",2 bed flat to rent,Listed on 13th Jun 2023
2083,Surrey,listing_64535454,"£4,350 pcm","Harestone Valley Road, Caterham CR3",5 bed detached house to rent,Listed on 3rd May 2023
2084,Surrey,listing_64867409,"£4,350 pcm","Oriel Lodge, Woking GU22",5 bed bungalow to rent,Listed on 14th Jun 2023
2085,Surrey,listing_39730227,"£4,500 pcm","Virginia Water, Surrey GU25",5 bed detached house to rent,Listed on 7th Jun 2023
2086,Surrey,listing_61192933,"£4,600 pcm","Tadworth Street, Tadworth KT20",5 bed detached house to rent,Listed on 21st Apr 2023
2087,Surrey,listing_64656655,"£4,900 pcm","Orchard Farm Avenue, Esher, Surrey KT8",4 bed detached house to rent,Listed on 18th May 2023
2088,Surrey,listing_64819310,"£4,950 pcm","Lyne Lane, Lyne, Chertsey, Surrey KT16",Detached house to rent,Listed on 8th Jun 2023
2089,Surrey,listing_64232442,"£5,250 pcm","Old Avenue, West Byfleet KT14",5 bed detached house to rent,Listed on 27th Mar 2023
2090,Surrey,listing_64289287,"£5,250 pcm","Old Avenue, West Byfleet KT14",5 bed detached house to rent,Listed on 29th Mar 2023
2091,Surrey,listing_64412317,"£5,500 pcm","Outwood Lane, Kingswood, Tadworth KT20",4 bed detached house to rent,Listed on 17th Apr 2023
2092,Surrey,listing_64621050,"£5,850 pcm","The Warren, Ashtead KT21",6 bed detached house to rent,Listed on 14th May 2023
2093,Surrey,listing_64865370,"£5,950 pcm","Marlborough Road, Richmond TW10",4 bed flat to rent,Listed on 13th Jun 2023
2094,Surrey,listing_50978639,"£6,000 pcm","Yarm Way, Leatherhead KT22",6 bed detached house to rent,Listed on 24th May 2023
2095,Surrey,listing_64169837,"£6,000 pcm","Golf Club Road, Weybridge KT13",5 bed detached house to rent,Listed on 14th Mar 2023
2096,Surrey,listing_64393275,"£6,000 pcm","Fearn Close, East Horsley, Leatherhead KT24",5 bed detached house to rent,Listed on 13th Apr 2023
2097,Surrey,listing_64807395,"£6,000 pcm","Roundhill Way, Cobham, Surrey KT11",5 bed detached house to rent,Listed on 7th Jun 2023
2098,Surrey,listing_64690276,"£6,250 pcm","Felix Lane, Shepperton TW17",3 bed property to rent,Listed on 23rd May 2023
2099,Surrey,listing_60935893,"£6,500 pcm","Pine Walk, Cobham, Surrey KT11",5 bed detached house to rent,Listed on 28th Apr 2023
2100,Surrey,listing_64740761,"£7,000 pcm","New Road, Esher, Surrey KT10",3 bed flat to rent,Listed on 30th May 2023
2101,Surrey,listing_64311467,"£7,500 pcm","Petersham Road, Richmond TW10",6 bed semi-detached house to rent,Listed on 31st Mar 2023
2102,Surrey,listing_63967616,"£8,000 pcm","Fairmile Avenue, Cobham, Surrey KT11",5 bed detached house to rent,Listed on 16th Feb 2023
2103,Surrey,listing_64371145,"£8,750 pcm","The Barton, Cobham, Surrey KT11",5 bed detached house to rent,Listed on 7th Jun 2023
2104,Surrey,listing_64660144,"£10,000 pcm","Broomfield Ride, Oxshott, Leatherhead, Surrey KT22",6 bed detached house to rent,Listed on 18th May 2023
2105,Surrey,listing_64771651,"£12,000 pcm","Accommodation Road, Longcross, Chobham, Surrey KT16",6 bed detached house to rent,Listed on 2nd Jun 2023
2106,Surrey,listing_64632442,"£12,500 pcm","Heath Rise, Virginia Water, Surrey GU25",6 bed detached house to rent,Listed on 16th May 2023
2107,Surrey,listing_64668574,"£14,000 pcm","Waterhouse Lane, Kingswood, Tadworth, Surrey KT20",7 bed detached house to rent,Listed on 19th May 2023
2108,Surrey,listing_64695754,"£14,000 pcm","Fairbourne, Cobham, Surrey KT11",5 bed detached house to rent,Listed on 23rd May 2023
2109,Surrey,listing_64208591,"£15,000 pcm","Esher Place Avenue, Esher, Surrey KT10",5 bed detached house to rent,Listed on 18th Mar 2023
2110,Surrey,listing_64705356,"£20,000 pcm","Orchard Rise, Richmond TW10",8 bed detached house to rent,Listed on 24th May 2023
2111,Surrey,listing_64754838,"£35,000 pcm","Woodlands Road West, Wentworth, Virginia Water, Surrey GU25",6 bed detached house to rent,Listed on 31st May 2023
2112,Surrey,listing_64449251,"£250,000 pcm","Abbots Drive, Wentworth, Surrey GU25",8 bed detached house to rent,Listed on 20th Apr 2023
2113,Tyne and Wear,listing_64865344,£400 pcm,"Ryedale, Wallsend NE28",Studio to rent,Listed on 13th Jun 2023
2114,Tyne and Wear,listing_64856261,£425 pcm,"Eglesfield Road, South Shields NE33",1 bed flat to rent,Listed on 12th Jun 2023
2115,Tyne and Wear,listing_64176523,£450 pcm,"Forth Street, Newcastle Upon Tyne NE17",3 bed terraced house to rent,Listed on 14th Mar 2023
2116,Tyne and Wear,listing_63745096,£475 pcm,"Tintern Street, Sunderland SR4",2 bed terraced house to rent,Listed on 5th May 2023
2117,Tyne and Wear,listing_64755868,£495 pcm,"East Moor Road, Sunderland SR4",2 bed end terrace house to rent,Listed on 31st May 2023
2118,Tyne and Wear,listing_64701688,£525 pcm,"Humber Street, Chopwell, Newcastle Upon Tyne NE17",3 bed terraced house to rent,Listed on 24th May 2023
2119,Tyne and Wear,listing_64831936,£550 pcm,"Castleside Road, Newcastle Upon Tyne NE15",3 bed flat to rent,Listed on 9th Jun 2023
2120,Tyne and Wear,listing_58470288,£575 pcm,"Brooklands Terrace, New York, North Shields NE29",3 bed flat to rent,Listed on 27th Apr 2023
2121,Tyne and Wear,listing_64749866,£600 pcm,"Argyle Square, Sunderland SR2",1 bed flat to rent,Listed on 31st May 2023
2122,Tyne and Wear,listing_64854882,£625 pcm,"Argyle Square, Sunderland SR2",1 bed flat to rent,Listed on 12th Jun 2023
2123,Tyne and Wear,listing_62152085,£650 pcm,"St. Julien Gardens, Wallsend NE28",2 bed flat to rent,Listed on 14th Jun 2023
2124,Tyne and Wear,listing_64774312,£650 pcm,"Southend Parade, Hebburn NE31",3 bed terraced house to rent,Listed on 2nd Jun 2023
2125,Tyne and Wear,listing_64805013,£650 pcm,"Julian Street, South Shields NE33",2 bed flat to rent,Listed on 6th Jun 2023
2126,Tyne and Wear,listing_55161470,£675 pcm,"South Avenue, Washington NE37",3 bed semi-detached house to rent,Listed on 12th Jun 2023
2127,Tyne and Wear,listing_64840917,£675 pcm,"West Street, Wallsend NE28",2 bed flat to rent,Listed on 11th Jun 2023
2128,Tyne and Wear,listing_64743914,£700 pcm,"Price Street, Hebburn NE31",1 bed property to rent,Listed on 30th May 2023
2129,Tyne and Wear,listing_61628246,£725 pcm,"Chirton Hill Drive, North Shields NE29",3 bed terraced house to rent,Listed on 14th Jun 2023
2130,Tyne and Wear,listing_64821869,£725 pcm,"Closefield Gr, Monkseaton, Whitley Bay. 8st. NE25",2 bed flat to rent,Listed on 8th Jun 2023
2131,Tyne and Wear,listing_62793515,£750 pcm,"Dukesfield, Shiremoor, Newcastle Upon Tyne NE27",2 bed flat to rent,Listed on 6th Jun 2023
2132,Tyne and Wear,listing_64854938,£775 pcm,"Derwentwater Drive, Blaydon On Tyne NE21",2 bed flat to rent,Listed on 12th Jun 2023
2133,Tyne and Wear,listing_64301178,£795 pcm,"Fenham, Newcastle Upon Tyne NE5",2 bed flat to rent,Listed on 30th Mar 2023
2134,Tyne and Wear,listing_64682381,£875 pcm,"Worsdell Drive, Gateshead NE8",2 bed flat to rent,Listed on 22nd May 2023
2135,Tyne and Wear,listing_64834874,£895 pcm,"Millers Bank, Wallsend NE28",3 bed semi-detached house to rent,Listed on 9th Jun 2023
2136,Tyne and Wear,listing_64861239,£950 pcm,"Dene Avenue, Rowlands Gill, Tyne And Wear NE39",3 bed semi-detached house to rent,Listed on 13th Jun 2023
2137,Tyne and Wear,listing_63304200,£995 pcm,"Tunstall Vale, Sunderland SR2",5 bed terraced house to rent,Listed on 12th May 2023
2138,Tyne and Wear,listing_16779185,"£1,100 pcm","Granville Road, Jesmond, Newcastle Upon Tyne NE2",1 bed flat to rent,Listed on 2nd May 2023
2139,Tyne and Wear,listing_64323156,"£1,100 pcm","Chirton Grove, South Shields NE34",3 bed semi-detached house to rent,Listed on 3rd Apr 2023
2140,Tyne and Wear,listing_64153250,"£1,150 pcm","Regent Farm Lane, Gosforth NE3",2 bed flat to rent,Listed on 10th Mar 2023
2141,Tyne and Wear,listing_62735543,"£1,190 pcm","Jesmond, Newcastle Upon Tyne NE2",2 bed flat to rent,Listed on 26th Oct 2022
2142,Tyne and Wear,listing_64793936,"£1,190 pcm","Jesmond, Newcastle Upon Tyne NE2",2 bed flat to rent,Listed on 5th Jun 2023
2143,Tyne and Wear,listing_64854893,"£1,250 pcm","Jesmond, Newcastle Upon Tyne NE2",2 bed flat to rent,Listed on 12th Jun 2023
2144,Tyne and Wear,listing_64840503,"£1,495 pcm","Brighton Grove, Whitley Bay NE26",3 bed semi-detached house to rent,Listed on 10th Jun 2023
2145,Tyne and Wear,listing_64153271,"£1,750 pcm","Regent Farm Lane, Gosforth NE3",2 bed flat to rent,Listed on 10th Mar 2023
2146,Tyne and Wear,listing_64468654,"£2,275 pcm","Sandpiper, 1Queens Road, Seaton Sluice NE26",2 bed flat to rent,Listed on 24th Apr 2023
2147,Tyne and Wear,listing_63421081,"£3,000 pcm","Stonehaugh Way, Newcastle Upon Tyne NE20",4 bed detached house to rent,Listed on 7th Dec 2022
2148,Tyne and Wear,listing_64658008,"£3,000 pcm","Rutherford Street, Newcastle Upon Tyne NE4",1 bed flat to rent,Listed on 18th May 2023
2149,Tyne and Wear,listing_64498721,"£3,640 pcm","Sweet William, 9 Granville Avenue, Seaton Sluice, Whitley Bay NE26",3 bed semi-detached house to rent,Listed on 27th Apr 2023
2150,Warwickshire,listing_63339505,£500 pcm,"Mile Tree Lane, Coventry CV2",2 bed mobile/park home to rent,Listed on 27th Nov 2022
2151,Warwickshire,listing_64831845,£576 pcm,"Tomwell Close, Southam CV47",3 bed maisonette to rent,Listed on 9th Jun 2023
2152,Warwickshire,listing_64826259,£595 pcm,"South Street, Atherstone CV9",1 bed flat to rent,Listed on 8th Jun 2023
2153,Warwickshire,listing_64624370,£645 pcm,"Coleshill Road, Atherstone CV9",1 bed property to rent,Listed on 15th May 2023
2154,Warwickshire,listing_64804951,£785 pcm,"Cowan Close, Rugby CV22",2 bed maisonette to rent,Listed on 6th Jun 2023
2155,Warwickshire,listing_14350337,£850 pcm,"Spencer Street, Leamington Spa CV31",1 bed flat to rent,Listed on 6th Jun 2023
2156,Warwickshire,listing_64800388,£895 pcm,"William James Way, Henley-In-Arden B95",1 bed flat to rent,Listed on 6th Jun 2023
2157,Warwickshire,listing_64822776,"£1,100 pcm","High Street, Henley-In-Arden B95",2 bed terraced house to rent,Listed on 8th Jun 2023
2158,Warwickshire,listing_61582625,"£1,200 pcm","Wisteria Way, Nuneaton, Warwickshire CV10",4 bed terraced house to rent,Listed on 9th Jun 2023
